"","pathway","pval","padj","log2err","ES","NES","size","leadingEdge"
"1256","REACTOME_RHOD_GTPASE_CYCLE",0.358974358974359,0.71808578337788,0.0758886900606117,0.368163255295581,1.06601865754801,50,"LBR, ARHGAP1, EMD, PLXNB1, TOR1AIP1, RAB7A, ARHGAP21, PIK3R1, RHOD, MCAM, ACTN1"
"1257","REACTOME_RHOF_GTPASE_CYCLE",0.0638888888888889,0.370940170940171,0.208955027549354,0.504373101555635,1.39844650938336,40,"ACTB, FARP1, ARHGAP1, TOR1AIP1, RAB7A, SNAP23, ARHGAP21, PIK3R1, MCAM, ACTN1, BASP1, RHOF, MYO9B, CAV1"
"1258","REACTOME_RHOG_GTPASE_CYCLE",0.0935064935064935,0.431721470019342,0.16440575583821,0.417057548797474,1.28239357982881,72,"LBR, ARHGAP1, ITGB1, ARFGAP3, MPP7, VAV3, CDC42EP1, EMD, RAB7A, ARHGAP21, PIK3R1, PLEKHG3, CDC42, KALRN, MCAM"
"1259","REACTOME_RHOH_GTPASE_CYCLE",0.686968838526912,0.847049974948856,0.0470699590082662,0.314259502847697,0.853533673451094,35,"TMEM59, WDR11, SLC1A5, RAB7A, NSFL1C, OSBPL11, MTR, CAV1, JUP, PAK2"
"1260","REACTOME_RHOJ_GTPASE_CYCLE",0.726648351648352,0.865599678352252,0.0431036828790402,0.29082027673399,0.845780951344703,53,"ARHGAP1, MPP7, CDC42EP1, SLC1A5, RAB7A, SNAP23, ARHGAP21, PIK3R1, CDC42"
"1261","REACTOME_RHOQ_GTPASE_CYCLE",0.541005291005291,0.794721014520245,0.0549073703290958,0.324191848935693,0.967236893120248,58,"ARHGAP1, IQGAP1, MPP7, CDC42EP1, SLC1A5, RAB7A, SNAP23, ARHGAP21, PLEKHG3, CDC42, CDC42EP4, CDC42BPB, WASL, CAV1, GOPC, ARHGEF9, JUP, PAK2"
"1262","REACTOME_RHOT1_GTPASE_CYCLE",0.203508771929825,0.579165947656025,0.126253987849115,0.700131027443662,1.24420095975785,5,"RHOT1, TRAK2, MYO19"
"1263","REACTOME_RHOU_GTPASE_CYCLE",0.534965034965035,0.794721014520245,0.107554375265169,-0.306402662647015,-0.974458156054703,39,"NCK2, GIT1, ITSN2, TXNL1, STAM, SPTAN1, GIT2, ARHGAP31, ARHGAP30, MYO6, USP9X"
"1264","REACTOME_RHOV_GTPASE_CYCLE",0.229452054794521,0.609065393154874,0.170932335370056,-0.37524587877689,-1.16152957188299,36,"NCK2, GIT1, CCP110, TXNL1, SPTAN1, CEP97, GIT2, SH3RF1"
"1265","REACTOME_RHO_GTPASES_ACTIVATE_CIT",0.0612855007473842,0.36922798443298,0.222056046145248,0.5963786348848,1.44205811238162,19,"MYL9, MYL6, MYH11, RHOB, CDKN1B"
"1266","REACTOME_RHO_GTPASES_ACTIVATE_FORMINS",0.267813267813268,0.629978093392727,0.0865399737444125,0.338231214458969,1.10620696912579,120,"ACTB, PFN1, CKAP5, ITGB1, CLIP1, NDEL1, NDE1, DVL2, RPS27, ACTG1, RHOB, NUP107, PAFAH1B1, PPP2R5A, CDC42, RHOD, TUBB4A, TUBA4A, TAOK1, PPP2R5E, KNL1, NUP43, SCAI, NUP133, SRF, SEC13, TUBB4B, TUBA1C, BUB3"
"1267","REACTOME_RHO_GTPASES_ACTIVATE_IQGAPS",0.0906432748538012,0.424142116297032,0.178219874951973,0.541140060538554,1.36644585097007,24,"ACTB, IQGAP1, CLIP1, ACTG1, CDC42, TUBB4A, TUBA4A, CDH1, TUBB4B, TUBA1C"
"1268","REACTOME_RHO_GTPASES_ACTIVATE_KTN1",0.431596091205212,0.753766562846434,0.0760837160951725,0.501860891738865,1.046395007008,10,"CDC42, KLC4, KIF5B, RHOG, KLC2"
"1269","REACTOME_RHO_GTPASES_ACTIVATE_NADPH_OXIDASES",0.919282511210762,0.955322349923544,0.0361491929398957,0.272562130211713,0.659061891235827,19,"CYBA, PRKCD, MAPK3, PIN1, PIK3R4"
"1270","REACTOME_RHO_GTPASES_ACTIVATE_PAKS",0.0184462971194223,0.210105424479297,0.352487857583619,0.633167729462405,1.55597263852839,21,"MYL9, MYL6, FLNA, MYH11, CDC42"
"1271","REACTOME_RHO_GTPASES_ACTIVATE_PKNS",0.0214494304213085,0.215238215094748,0.352487857583619,0.584120404497314,1.53546655048581,30,"MYL9, MYL6, MYH11, PPP1R14A, KDM1A, RHOB, NCOA2, YWHAH"
"1272","REACTOME_RHO_GTPASES_ACTIVATE_RHOTEKIN_AND_RHOPHILINS",0.934010152284264,0.962611520653422,0.0598603117764473,-0.278624652278629,-0.588829927788268,8,"TAX1BP3, RHPN2"
"1273","REACTOME_RHO_GTPASES_ACTIVATE_ROCKS",0.0508221225710015,0.34280040170159,0.245041785430996,0.602553217049261,1.45698840293864,19,"MYL9, MYL6, MYH11, RHOB"
"1274","REACTOME_RHO_GTPASES_ACTIVATE_WASPS_AND_WAVES",0.0426136363636364,0.310828877005348,0.261663521711573,0.537011608333904,1.44999514779798,34,"ACTB, ABI1, CYFIP2, GRB2, ARPC5, ACTG1, CDC42, NCKAP1, MAPK3, ABL1, NCKIPSD, WASL, WASF3"
"1275","REACTOME_RHO_GTPASE_CYCLE",0.0272304973240522,0.244933385256759,0.352487857583619,-0.261381266026281,-1.15158411648042,418,"RASGRF2, DOCK9, STK10, RAPGEF1, MSI2, PKP4, BRK1, GNA13, MCF2L, NCK2, ARHGEF12, GIT1, PIK3R3, FAM91A1, CCP110, IL32, ARHGAP18, CPNE8, ARHGDIA, ITSN2, SHKBP1, TXNL1, SCFD1, ARHGAP26, NHS, GJA1, DOCK1, CDC37, STK38, CHN1, STAM, SPTAN1, PLEKHG1, STMN2, NDUFA5, AKAP12, ARHGAP32, LMNB1, PICALM, YKT6, TFRC, AAAS, C1QBP, VRK2, TIAM1, DOCK3, ARHGAP42, SLC4A7, KCTD3, RBMX, CDC42BPA, CEP97, BCAP31, ARHGAP24, PREX2, TUBA1B, SOS1, GIT2, SH3RF1, RHOBTB1, PKN3, ARHGEF15, ARHGAP31, OPHN1, FMNL1, DIAPH2, ARHGAP4, MOSPD2, FAM135A, HSP90AA1, STARD13, CDC42EP3, ARHGAP30, NUDC, ARHGAP20, CCDC88A, ACBD5, ABI2, FMNL3, ARHGAP27, MYO6, ARHGAP17, ABR, ABL2, SAMM50, BCR"
"1276","REACTOME_RHO_GTPASE_EFFECTORS",0.0333704115684093,0.269446672012831,0.261663521711573,0.368840654723081,1.28158489362816,230,"MYL9, ACTB, PFN1, ABI1, MYL6, CKAP5, IQGAP1, ITGB1, CYFIP2, CLIP1, NDEL1, FLNA, NDE1, DVL2, MYH11, PPP1R14A, GRB2, KDM1A, ARPC5, CYBA, RPS27, ACTG1, RHOB, NUP107, PAFAH1B1, PPP2R5A, CDC42, RHOD, NCKAP1, TUBB4A, PRKCD, TUBA4A, NCOA2, TAOK1, KLC4, YWHAH, MAPK3, CDKN1B, ABL1, PPP2R5E, KNL1, NCKIPSD, WASL, NUP43, SCAI, NUP133, SRF, KIF5B, GOPC, WASF3, PIN1, CDH1, SEC13, PIK3R4, PAK2, RHOG, TUBB4B, TUBA1C, BUB3, YWHAQ, KLC2"
"1277","REACTOME_RIBAVIRIN_ADME",0.514190317195326,0.789243493060199,0.0684714904492087,0.491144416957872,0.991755461146853,9,"SLC29A1, NT5C2"
"1278","REACTOME_RIPK1_MEDIATED_REGULATED_NECROSIS",0.782467532467532,0.88777714233616,0.0810802057550866,-0.274958665584044,-0.824502987328098,30,"PELI1, CDC37, MLKL, HSP90AA1, TRAF2, OGT, RIPK1, FADD"
"1279","REACTOME_RIP_MEDIATED_NFKB_ACTIVATION_VIA_ZBP1",0.867834394904459,0.923137567128762,0.0417397034728504,0.304777600048107,0.693281852057174,15,"IKBKG, NFKB1, TICAM1, NFKBIB, RELA, CHUK, NKIRAS2, MYD88"
"1280","REACTOME_RMTS_METHYLATE_HISTONE_ARGININES",0.282420749279539,0.644260736858449,0.0925528864684773,0.432218583128094,1.13616502998674,30,"JAK2, SMARCD3, RBBP7, PRMT7, SMARCD1, ACTL6A, SMARCD2, SMARCA4, ARID1A, PBRM1, RPS2, PRMT5, WDR5, PRMT1, SMARCB1"
"1281","REACTOME_RNA_POLYMERASE_III_CHAIN_ELONGATION",0.373529411764706,0.724570960186765,0.119887845115423,-0.387429362010315,-1.04732497107265,18,"POLR3GL, POLR3K"
"1282","REACTOME_RNA_POLYMERASE_III_TRANSCRIPTION",0.136490250696379,0.508470118474064,0.13880510939114,0.462036112089091,1.28804312096993,41,"NFIC, SNAPC3, ZNF143, POLR1C, GTF3C5, SNAPC1, POLR3D, POLR2H, BRF2, SSB, GTF3C4, NFIA, NFIX"
"1283","REACTOME_RNA_POLYMERASE_III_TRANSCRIPTION_INITIATION_FROM_TYPE_1_PROMOTER",0.8,0.893118971061093,0.0787113806986485,-0.268477847346622,-0.792454518767732,28,"POLR3GL, POLR3K, TBP"
"1284","REACTOME_RNA_POLYMERASE_III_TRANSCRIPTION_INITIATION_FROM_TYPE_3_PROMOTER",0.323144104803493,0.685792378898367,0.0855356947987884,0.429271741408413,1.11167388506082,28,"SNAPC3, ZNF143, POLR1C, SNAPC1, POLR3D, POLR2H, BRF2"
"1285","REACTOME_RNA_POLYMERASE_III_TRANSCRIPTION_TERMINATION",0.359467455621302,0.71808578337788,0.0806388495950661,0.434561487834662,1.08782138047353,23,"NFIC, POLR1C, POLR3D, POLR2H, SSB, NFIA, NFIX"
"1286","REACTOME_RNA_POLYMERASE_II_PRE_TRANSCRIPTION_EVENTS",0.224203821656051,0.606258309026331,0.0988903007520636,0.373058125030292,1.15882045906787,76,"CDK7, NELFCD, GTF2A1, GTF2F1, NELFB, GTF2H2, CCNT1, TAF12, TAF7, PAF1, ELOA, POLR2H, TAF10, RTF1, SUPT4H1, POLR2C, TAF4B, GTF2H3, POLR2I, SUPT6H, ELOB, POLR2B, SSRP1, ELL, NELFA"
"1287","REACTOME_RNA_POLYMERASE_II_TRANSCRIBES_SNRNA_GENES",0.0247974566225829,0.235237074845923,0.352487857583619,0.472023864282874,1.45140730536517,72,"SNAPC3, ELL2, PCF11, CDK7, ZNF143, GTF2A1, INTS9, GTF2F1, INTS6, TAF8, POU2F2, RPRD1A, CCNT1, SRRT, SNAPC1, INTS14, POLR2H, SUPT4H1, RPRD2, POLR2C, POLR2I, POLR2B, SP1, ELL, SSU72, GTF2B, RPRD1B, SNAPC4, ICE2, INTS8"
"1288","REACTOME_RNA_POLYMERASE_II_TRANSCRIPTION",4.57884619451678e-05,0.00397443849684056,0.557332238758646,0.353978128027015,1.30365939300025,1167,"FKBP5, BCL6, MYL9, MAGOH, RORB, SIRT1, ITGBL1, PML, RRAGC, LBR, TEAD3, PPARGC1A, RHEB, SNAPC3, KAT5, PHC2, ZNF717, BTG1, ZNF460, TP63, PRKACA, SUZ12, SNRPG, RNGTT, ZKSCAN8, RAD9A, ELL2, BMI1, PCF11, MAML1, EPC1, CDK7, UBE2E1, ZNF333, NELFCD, RFFL, ZNF143, COX7C, APAF1, COL1A1, NDUFA4, PSMD5, DDIT3, NOTCH3, ZNF706, SLC38A9, GTF2A1, ZNF471, L3MBTL1, SRSF11, ZNF708, ANAPC4, SMURF1, UBE2I, HDAC6, MED14, HTT, MED30, INTS9, U2AF1, GTF2F1, PSMD8, NFYB, PSMC2, BBC3, ZNF248, ZNF552, TMEM219, DGCR8, CREBBP, ZNF688, ZNF568, INTS6, NELFB, ZNF624, ZNF641, SRRM1, ZNF263, RING1, TEAD2, COL1A2, THBS1, LDB1, U2AF2, SMARCD3, RUNX2, FBXO32, TP53BP2, RUNX1, ZNF302, TAF8, GPS2, POU2F2, GTF2H2, RPRD1A, CCNT1, MGA, ZNF586, TGIF1, DAXX, CITED4, BNIP3L, MSH2, MAML3, PSMB7, PRKAA1, COX5A, ZNF154, UBA52, NUAK1, SNRPD3, TAF12, ZNF606, AKT3, ARNT, CPSF2, SRRT, CDK6, PRKAB1, TAF7, SNAPC1, PAF1, RBX1, USP2, RORA, ZNF529, USP7, PSMB6, ELOA, ZNF383, TP53RK, SREBF1, RBBP7, CBX6, ZNF3, ANAPC1, ZKSCAN5, ZNF266, INTS14, COX6C, CHEK1, EP300, ATAD2, PSMD13, BRD1, MAP2K6, ABCA6, POLR2H, RFC2, MTOR, CDC26, ZNF689, SATB2, ZNF738, THRA, CCNG2, TAF10, SRSF5, ZNF79, ZNF500, RARB, ZNF354C, COX7B, TXNIP, NR2C2AP, RTF1, PERP, COX5B, SMARCD1, ATM, NR2C1, DNA2, KCTD1, KRBA1, ACTL6A, MDM2, ZNF701, FANCC, BRD7, SUPT4H1, ZNF267, ANAPC7, SMARCD2, ZNF710, PPARG, HDAC8, ZNF582, ZNF566, ZNF790, DDB2, ZNF394, ZNF558, ZNF470, ANAPC5, MAF, ALYREF, FAS, RPRD2, ZNF75D, UXT, ZNF224, ZFP28, ZNF778, POLR2C, CAMK2B, NCOR1, ELF2, KLF4, CDK2, ZNF615, YWHAH, TWIST2, MAML2, NFKB1, MAPK3, CDKN1B, ZNF175, BARD1, TAF4B, CSNK2A2, GTF2H3, SMARCA4, ABL1, UBB, YY1, GSR, ZFP14, MDC1, POLR2I, SMAD2, SKIL, PSME1, SUPT6H, ARID1A, SESN1, RRM2B, ARID3A, PSMA4, TIGAR, ZNF100, ZNF621, THRB, STAT1, ELOB, NRBP1, NR1H2, ZNF649, WDR33, ZNF235, MOV10, TNRC6A, ZNF441, ASH2L, RAD1, RBL2, CPSF1, PMS2, PABPN1, HDAC5, ZNF561, PSMD12, EIF4A3, ELF1, DYRK2, NR2F1, CAV1, SRF, FURIN, CNOT6, TFDP2, SNW1, ANAPC16, SETD1B, SRSF2, PIN1, POLR2B, ANAPC11, YAP1, ZNF600, CPSF4, RPA2, SP1, PSMB1, MED17, BCL2L14, MED13, SSRP1, WWOX, ELL, KAT2B, RNF111, ZNF521, TNKS1BP1, SSU72, PBRM1, LAMTOR2, HDAC1, NELFA, HIPK1, RARA, FOS, CASC3, ZNF584, HIPK2, PRKAG2, ZNF785, ITGA5, SARNP, PSMD14, SMURF2, THOC7, SESN2, SMYD2, YBX1, RPS27A, MED16, PCGF6, RPA1, PCNA, YWHAQ, ZNF704, BRPF1, RXRB, SOCS3, TP53INP1, SOD2, PSMD6, BCL2L11, RBBP4, CNOT8, ZNF740, FYTTD1, ZNF317, RABGGTA, PIP4K2A, TOPBP1, CDC40, PSMF1, ZNF197, GTF2B, ING5, TRIM28, RBM8A, ZNF12, ZSCAN32, RPRD1B, E2F4, ZNF19"
"1289","REACTOME_RNA_POLYMERASE_II_TRANSCRIPTION_TERMINATION",0.021020622978913,0.214657655831723,0.352487857583619,0.483274331346698,1.44572501792049,63,"MAGOH, SNRPG, PCF11, SRSF11, U2AF1, SRRM1, U2AF2, SNRPD3, CPSF2, SRSF5, ALYREF, WDR33, CPSF1, PABPN1, EIF4A3, SRSF2, CPSF4, CASC3, SARNP, THOC7, FYTTD1, CDC40, RBM8A, MAGOHB, CPSF7, NUDT21, NCBP1, SRSF3"
"1290","REACTOME_RNA_POLYMERASE_I_PROMOTER_ESCAPE",0.360703812316716,0.71808578337788,0.0799858801499946,0.421485301438738,1.08174814586359,27,"CDK7, POLR1C, GTF2H2, UBTF, POLR2H, GTF2H3, POLR1B, TAF1A, CCNH"
"1291","REACTOME_RNA_POLYMERASE_I_TRANSCRIPTION",0.45467032967033,0.77116997057027,0.0649407684612899,0.348483757049673,0.990981217814848,47,"CDK7, POLR1C, GTF2H2, UBTF, RBBP7, POLR2H, MAPK3, GTF2H3, KAT2B, HDAC1, POLR1B, RBBP4, TAF1A, MBD2, CCNH"
"1292","REACTOME_RNA_POLYMERASE_I_TRANSCRIPTION_INITIATION",0.532235939643347,0.794721014520245,0.0573667426768556,0.338698134418058,0.953862364628774,43,"CDK7, POLR1C, GTF2H2, UBTF, RBBP7, POLR2H, GTF2H3, KAT2B, HDAC1, POLR1B, RBBP4, TAF1A, CCNH, CHD4, ERCC3, EHMT2, ERCC6"
"1293","REACTOME_RNA_POLYMERASE_I_TRANSCRIPTION_TERMINATION",0.378299120234604,0.724570960186765,0.0774767547848578,0.416348363510028,1.06856412008421,27,"CDK7, POLR1C, GTF2H2, UBTF, POLR2H, GTF2H3, POLR1B, TAF1A, CCNH"
"1294","REACTOME_RND1_GTPASE_CYCLE",0.418181818181818,0.749188479219439,0.0699458736501659,0.378665490754892,1.04168805708798,38,"RRAS2, TMEM59, PTPN13, FRS3, PIK3R1, ALDH3A2, DLG5, KIDINS220, RASAL2, CAV1, DST, PLXNA1, ANKRD26"
"1295","REACTOME_RND2_GTPASE_CYCLE",0.226573426573427,0.607298028604561,0.103958471559957,0.43060748154667,1.18457763321836,38,"ARHGAP1, PTPN13, KCTD13, LRRC1, FRS3, NISCH, PIK3R1, ALDH3A2, DLG5, KIDINS220, TNFAIP1, CAV1, DST, CKAP4, ANKRD26, RND2, GOLGA3, EPHA2"
"1296","REACTOME_RND3_GTPASE_CYCLE",0.317482517482517,0.678702141544643,0.0843144320642653,0.406887486004636,1.11734353800394,37,"RND3, PTPN13, KCTD13, NISCH, ARHGAP21, PIK3R1, DLG5, CKB, TNFAIP1, RASAL2, CAV1, DST, CKAP4, ANKRD26, TMOD3, EPHA2, FLOT2"
"1297","REACTOME_ROBO_RECEPTORS_BIND_AKAP5",0.577302631578947,0.800174459522417,0.0621124188949471,0.455834191542588,0.911963205135387,8,"PRKACA, PRKAR2A"
"1298","REACTOME_ROLE_OF_ABL_IN_ROBO_SLIT_SIGNALING",0.0723684210526316,0.390160183066362,0.213927855492356,0.715105080846736,1.4306726736111,8,"SLIT2, ROBO1, CAP1, ABL1"
"1299","REACTOME_ROLE_OF_LAT2_NTAL_LAB_ON_CALCIUM_MOBILIZATION",0.698717948717949,0.850613154960981,0.0519512476197082,0.381488323936927,0.848142938511213,13,"GRB2, LYN, PIK3R1, GAB2"
"1300","REACTOME_ROLE_OF_PHOSPHOLIPIDS_IN_PHAGOCYTOSIS",0.229289940828402,0.609065393154874,0.106729884364606,0.470088753168288,1.17675544366502,23,"ITPR1, PLPP5, AHCYL1, PLD3, PIK3R1, PRKCD, PLD2, PLCG2, FCGR2A"
"1301","REACTOME_ROLE_OF_SECOND_MESSENGERS_IN_NETRIN_1_SIGNALING",0.931596091205212,0.962611520653422,0.0395172228473919,0.273452334129085,0.570156315818779,10,"NTN1, TRPC1, TRPC4"
"1302","REACTOME_RORA_ACTIVATES_GENE_EXPRESSION",0.0891238670694864,0.422986074283372,0.183023938384487,0.576475610770248,1.3781772468921,18,"CREBBP, SMARCD3, RORA, SREBF1, EP300, NCOA2, CHD9, CPT1A, NCOA1, TGS1, TBL1XR1, PPARA"
"1303","REACTOME_ROS_AND_RNS_PRODUCTION_IN_PHAGOCYTES",0.4625,0.772762271414822,0.109684061970549,-0.335991192606462,-0.991031332150617,27,"ATP6V0B, ATP6V1A, NOS1, ATP6V0D1, NOS3, ATP6V0E2"
"1304","REACTOME_RRNA_MODIFICATION_IN_THE_MITOCHONDRION",0.763793103448276,0.879967558799676,0.051218434854034,0.414190278369062,0.764583005601011,6,"TFB1M, MRM1, MRM3, NSUN4"
"1305","REACTOME_RRNA_MODIFICATION_IN_THE_NUCLEUS_AND_CYTOSOL",0.357615894039735,0.71808578337788,0.0751181635276301,0.360172598987446,1.07913143813069,60,"DHX37, RCL1, UTP6, WDR46, BMS1, NOP14, RPS14, SNU13, RPS9, NOP56, RPS6, NOC4L, WDR36, NAT10, UTP15, TRMT112, RRP9, RPS2, KRR1, HEATR1, TBL3, NOL11, DDX49, NOP10"
"1306","REACTOME_RRNA_PROCESSING",1.51202612403311e-06,0.000187491239380106,0.643551836150722,0.514413113342029,1.75876805905903,197,"DHX37, RPS13, RPS27L, RPL18, RPS24, RCL1, RPL23, RPL10, UTP6, WDR46, RPL13A, FAU, EXOSC1, RPL3, RPL7A, RPS15, RPS25, RPL14, RPL34, BMS1, RPL41, GNL3, RPL12, RPS11, RPS15A, NOP14, TFB1M, UBA52, RPL19, RPL10A, RPS14, RPL7, RBM28, RIOK1, RPS27, RPL23A, ELAC2, RPL37, SNU13, RPS16, TRMT10C, FTSJ3, RPP30, RPLP1, MTREX, RPS9, RPS4X, EXOSC10, RPL30, RPL22, RPSA, RPS28, NOP56, EXOSC5, RPS6, TEX10, RPL37A, NOC4L, WDR36, RIOK2, RPL4, RPS26, RPL38, RPL22L1, NAT10, RPL39, EBNA1BP2, RPL18A, PELP1, RPS12, RPS3A, UTP15, RPS27A, TRMT112, RPLP2, RPLP0, NOL9, RRP9, RPS17, BOP1, RPS23, RPL32, RPL24"
"1307","REACTOME_RRNA_PROCESSING_IN_THE_MITOCHONDRION",0.312186978297162,0.676599992913699,0.0952879846194844,0.573956924457778,1.15897665664166,9,"TFB1M, ELAC2, TRMT10C, HSD17B10, MRM1, MRM3"
"1308","REACTOME_RSK_ACTIVATION",0.338954468802698,0.698841992685848,0.0911073131586733,0.595646106776013,1.14660878758222,7,"RPS6KA6, MAPK3, RPS6KA2, RPS6KA3, MAPK1"
"1309","REACTOME_RSV_HOST_INTERACTIONS",0.118320610687023,0.479917243347364,0.142901149386948,0.407739255550089,1.26506217870193,75,"SDC2, CDK19, IRF3, MED14, TLR2, MED30, SDC4, CREBBP, MED28, UBA52, GPC1, RBX1, EP300, STAT2, GPC4, MED29, HERC5, MED13L, JAK1, UBB, ELOB, MED21, MED17, MED19, MED13, RPS27A, MED16, ARIH1, TYK2"
"1310","REACTOME_RUNX1_AND_FOXP3_CONTROL_THE_DEVELOPMENT_OF_REGULATORY_T_LYMPHOCYTES_TREGS",0.46551724137931,0.774349651740974,0.0751181635276301,0.564631936826224,1.04229385831273,6,"RUNX1, IL2RA, CBFB, CR1, NFATC2"
"1311","REACTOME_RUNX1_INTERACTS_WITH_CO_FACTORS_WHOSE_PRECISE_EFFECT_ON_RUNX1_TARGETS_IS_NOT_KNOWN",0.0138800535855366,0.18393719866024,0.380730400722792,0.556764690514608,1.51218151634735,35,"PHC2, BMI1, RING1, SMARCD3, RUNX1, CBX6, EP300, SMARCD1, ACTL6A, SMARCD2, CSNK2A2, SMARCA4, ARID1A, PBRM1, HIPK2"
"1312","REACTOME_RUNX1_REGULATES_ESTROGEN_RECEPTOR_MEDIATED_TRANSCRIPTION",0.613793103448276,0.813161013815272,0.0614364107201271,0.485345272330604,0.895933020287161,6,"RUNX1, GPAM"
"1313","REACTOME_RUNX1_REGULATES_EXPRESSION_OF_COMPONENTS_OF_TIGHT_JUNCTIONS",0.0763888888888889,0.398231564898232,0.248911114434702,-0.758493218712818,-1.43576957687187,5,"OCLN, CLDN5"
"1314","REACTOME_RUNX1_REGULATES_GENES_INVOLVED_IN_MEGAKARYOCYTE_DIFFERENTIATION_AND_PLATELET_FUNCTION",0.392655367231638,0.733672641286847,0.0736212741014394,0.393478801308877,1.05072769333947,32,"MYL9, THBS1, RUNX1, EP300, MOV10, TNRC6A, ASH2L, SETD1B, KAT2B, HDAC1"
"1315","REACTOME_RUNX1_REGULATES_TRANSCRIPTION_OF_GENES_INVOLVED_IN_BCR_SIGNALING",0.191228070175439,0.565487662531556,0.130777137971974,0.70430438694216,1.25161742566196,5,"RUNX1, ELF2, ELF1, PAX5"
"1316","REACTOME_RUNX1_REGULATES_TRANSCRIPTION_OF_GENES_INVOLVED_IN_DIFFERENTIATION_OF_HSCS",0.751315789473684,0.874771435631332,0.0395979123961192,0.279593412745387,0.844834707212567,65,"CDK7, PSMD5, PSMD8, PSMC2, LDB1, RUNX1, PSMB7, UBA52, PSMB6, PSMD13, ABL1, UBB, PSME1, PSMA4, PSMD12, YAP1, PSMB1, PSMD14, RPS27A, PSMD6, PSMF1, KMT2A, PSMB4, CCNH, PSMD11"
"1317","REACTOME_RUNX1_REGULATES_TRANSCRIPTION_OF_GENES_INVOLVED_IN_DIFFERENTIATION_OF_KERATINOCYTES",0.914691943127962,0.953711358417241,0.057609110864425,-0.305621600356467,-0.597573733613949,6,"SOCS4, CTSL"
"1318","REACTOME_RUNX1_REGULATES_TRANSCRIPTION_OF_GENES_INVOLVED_IN_DIFFERENTIATION_OF_MYELOID_CELLS",0.124137931034483,0.486451966061491,0.16440575583821,0.725178216072327,1.33865754219106,6,"CREBBP, RUNX2, RUNX1"
"1319","REACTOME_RUNX1_REGULATES_TRANSCRIPTION_OF_GENES_INVOLVED_IN_INTERLEUKIN_SIGNALING",0.154255319148936,0.527272518882738,0.148261500475107,0.774214250068536,1.29620097791876,4,"RUNX1, ELF1"
"1320","REACTOME_RUNX1_REGULATES_TRANSCRIPTION_OF_GENES_INVOLVED_IN_WNT_SIGNALING",0.535460992907801,0.794721014520245,0.0694481442003175,0.590772415946648,0.989079939060391,4,"RUNX1, CBFB"
"1321","REACTOME_RUNX2_REGULATES_BONE_DEVELOPMENT",0.440353460972018,0.760650356465097,0.0699458736501659,0.40013795238138,1.01734788202166,26,"COL1A1, HDAC6, RUNX2, SATB2, MAF, MAPK3, ABL1, YAP1, ZNF521"
"1322","REACTOME_RUNX2_REGULATES_CHONDROCYTE_MATURATION",0.712765957446808,0.858087172071886,0.0557104226766671,0.497429078195246,0.832803138853138,4,"RUNX2"
"1323","REACTOME_RUNX2_REGULATES_GENES_INVOLVED_IN_CELL_MIGRATION",0.014758995021035,0.189789743381605,0.380730400722792,0.813991509257777,1.56692003341382,7,"ITGBL1, RUNX2, AKT3, ITGA5"
"1324","REACTOME_RUNX2_REGULATES_OSTEOBLAST_DIFFERENTIATION",0.140695915279879,0.513126279256029,0.142901149386948,0.521850418909334,1.28241686277493,21,"COL1A1, HDAC6, RUNX2, SATB2, MAF, MAPK3, ABL1, YAP1, ZNF521"
"1325","REACTOME_RUNX3_REGULATES_BCL2L11_BIM_TRANSCRIPTION",0.745614035087719,0.871482172300528,0.0531298054705469,0.439571940597277,0.781162109570643,5,"BCL2L11, FOXO3, SMAD4"
"1326","REACTOME_RUNX3_REGULATES_CDKN1A_TRANSCRIPTION",0.643031784841076,0.824199120972101,0.0764767053228531,-0.430215059026827,-0.872749250999873,7,"TP53, CDKN1A, TGFB1, SMAD3"
"1327","REACTOME_RUNX3_REGULATES_IMMUNE_RESPONSE_AND_CELL_MIGRATION",0.763888888888889,0.879967558799676,0.0650877566917313,-0.390635591011002,-0.73944325852874,5,"CBFB, RUNX3, ITGAL, SPP1, ITGA4"
"1328","REACTOME_RUNX3_REGULATES_NOTCH_SIGNALING",0.0569620253164557,0.358589973728147,0.237793834423688,0.635595958268067,1.43806312452673,14,"MAML1, CREBBP, MAML3, EP300, MAML2, SNW1, KAT2B"
"1329","REACTOME_RUNX3_REGULATES_P14_ARF",0.864820846905538,0.921175820661181,0.0429311093452583,0.329224001113965,0.686441913732748,10,"RUNX1, EP300, CDKN2A"
"1330","REACTOME_RUNX3_REGULATES_WNT_SIGNALING",0.0964467005076142,0.435212888377445,0.231126709673834,-0.671937491692668,-1.42003552620305,8,"TCF7L1, CCND1, CTNNB1, TCF7"
"1331","REACTOME_RUNX3_REGULATES_YAP1_MEDIATED_TRANSCRIPTION",0.45531197301855,0.77116997057027,0.0751181635276301,0.535576987163677,1.03097673756745,7,"TEAD3, TEAD2, YAP1"
"1332","REACTOME_SARS_COV_1_ACTIVATES_MODULATES_INNATE_IMMUNE_RESPONSES",0.457342657342657,0.771571285857,0.0655321029282414,0.365969961711893,1.00676335096771,38,"PPIB, IRF3, NPIPB3, RUNX1, UBA52, PPIH, NFKB1, UBB, IRAK2, RPS27A, MAVS, PCBP2, RELA"
"1333","REACTOME_SARS_COV_1_HOST_INTERACTIONS",0.00113305971426426,0.0468331348562562,0.45505986738723,0.51858326499267,1.64743096605156,91,"RPS13, RPS27L, RPS24, PPIB, FAU, IRF3, UBE2I, RPS15, RPS25, NPIPB3, RUNX1, RPS11, RPS15A, UBA52, RPS14, RPS27, RPS16, EP300, EEF1A1, PPIH, RPS9, RPS4X, RPSA, RPS28, YWHAH, NFKB1, UBB, RPS6, RPS26, CAV1, SP1, RPS12, RPS3A, IRAK2, RPS27A, YWHAQ, RPS17, RPS23, RPS2, SERPINE1, MAVS, PCBP2, RELA"
"1334","REACTOME_SARS_COV_1_INFECTION",0.00153555276530689,0.0502965962372219,0.45505986738723,0.469782753405083,1.55812596045837,135,"RPS13, GANAB, RPS27L, GALNT1, RPS24, PPIB, FAU, IRF3, UBE2I, RPS15, RPS25, NPIPB3, CHMP3, CHMP7, RUNX1, RPS11, RPS15A, UBA52, RPS14, RPS27, RPS16, EP300, ST6GAL1, EEF1A1, MAP1LC3B, PPIH, RPS9, RPS4X, RPSA, RPS28, YWHAH, VHL, PARP14, NFKB1, CHMP4C, ST3GAL4, UBB, RPS6, PARP8, ST3GAL3, CHMP6, RPS26, CAV1, CHMP2A, SP1, DDX5, RPS12, PIK3R4, RPS3A, IRAK2, RPS27A, YWHAQ, RPS17, RPS23, RPS2, SERPINE1, MAVS, GSK3A, PCBP2, RELA"
"1335","REACTOME_SARS_COV_1_MODULATES_HOST_TRANSLATION_MACHINERY",0.000395116576436969,0.0221265282804703,0.49849310876659,0.657038704026087,1.79331157720738,36,"RPS13, RPS27L, RPS24, FAU, RPS15, RPS25, RPS11, RPS15A, RPS14, RPS27, RPS16, EEF1A1, RPS9, RPS4X, RPSA, RPS28, RPS6, RPS26, RPS12, RPS3A, RPS27A, RPS17, RPS23"
"1336","REACTOME_SARS_COV_1_TARGETS_HOST_INTRACELLULAR_SIGNALLING_AND_REGULATORY_PATHWAYS",0.24203821656051,0.615698357457939,0.107972360317345,0.522737437447178,1.18907813013751,15,"UBE2I, EP300, YWHAH, CAV1, SP1, YWHAQ, SERPINE1"
"1337","REACTOME_SARS_COV_2_ACTIVATES_MODULATES_INNATE_AND_ADAPTIVE_IMMUNE_RESPONSES",0.05875,0.362953736654804,0.206587922696891,0.414947873011164,1.32914821942063,102,"NUP188, IKBKG, MAP3K7, IRF3, TLR2, CREBBP, SEC24A, NUP54, UBA52, POM121, NUP214, HLA-F, HLA-A, NUP107, NUP35, POM121C, STAT2, IL17RA, RNF135, JAK1, UBB, MASP2, SEC24D, STAT1, MASP1, NUP43, NUP133, CNBP, HLA-C, TAB3, SEC13, PIK3R4, IRAK2, RPS27A, B2M"
"1338","REACTOME_SARS_COV_2_HOST_INTERACTIONS",5.15760196085161e-05,0.00426361762097066,0.557332238758646,0.482621675525246,1.63136279128661,174,"PATJ, RPS13, SNRPG, RPS27L, NUP188, IKBKG, MAP3K7, RPS24, FAU, IRF3, GEMIN2, RPS15, TLR2, RPS25, VPS45, CREBBP, SEC24A, DDX20, RPS11, RPS15A, NUP54, UBA52, SNRPD3, RPS14, POM121, AKT3, NUP214, HLA-F, HLA-A, RPS27, NUP107, RPS16, NUP35, POM121C, STAT2, IL17RA, MAP1LC3B, RNF135, RPS9, RPS4X, SNRPD2, RPSA, RPS28, JAK1, YWHAH, UBB, MASP2, RPS6, SEC24D, STAT1, MASP1, NUP43, RPS26, NUP133, CAV1, CNBP, HLA-C, TAB3, RPS12, SEC13, PIK3R4, RPS3A, IRAK2, RPS27A, YWHAQ, B2M, VPS16, RPS17, RPS23, VPS18, TYK2"
"1339","REACTOME_SARS_COV_2_INFECTION",0.0106274370636761,0.162732194748665,0.380730400722792,0.389438774853611,1.36060156701097,265,"PATJ, SDC2, RPS13, GANAB, SNRPG, RPS27L, NUP188, IKBKG, MAP3K7, GALNT1, RPS24, FAU, IRF3, GEMIN2, UBE2I, RPS15, TLR2, RPS25, SDC4, MAN1B1, VPS45, CREBBP, CHMP3, CHMP7, SEC24A, ANO1, DDX20, RPS11, RPS15A, NUP54, UBA52, SNRPD3, GPC1, RPS14, POM121, AKT3, NUP214, HLA-F, HLA-A, RPS27, ZDHHC11, NUP107, RPS16, NUP35, POM121C, ST6GAL1, STAT2, IL17RA, GPC4, MAP1LC3B, RNF135, RPS9, RPS4X, SNRPD2, SRPK1, RPSA, DAD1, RPS28, JAK1, YWHAH, VHL, PARP14, CHMP4C, ST3GAL4, UBB, MASP2, RPS6, SEC24D, RPN1, STAT1, PARP8, ST3GAL3, CHMP6, MASP1, NUP43, RPS26, NUP133, CAV1, EDEM2, CNBP, FURIN, CSNK1A1, HLA-C, CHMP2A, TAB3, ISCU, DDX5, RPS12, SEC13, PIK3R4, RPS3A, IRAK2, RPS27A, YWHAQ, B2M, VPS16, RPS17, RPS23"
"1340","REACTOME_SARS_COV_2_MODULATES_AUTOPHAGY",0.671009771986971,0.837571365647755,0.0545680646670941,0.416840648089479,0.869125249762975,10,"VPS45, MAP1LC3B, VPS16, VPS18, VPS39"
"1341","REACTOME_SARS_COV_2_MODULATES_HOST_TRANSLATION_MACHINERY",0.00128937304501282,0.0471841917826444,0.45505986738723,0.596120174939313,1.71521858777136,49,"RPS13, SNRPG, RPS27L, RPS24, FAU, GEMIN2, RPS15, RPS25, DDX20, RPS11, RPS15A, SNRPD3, RPS14, RPS27, RPS16, RPS9, RPS4X, SNRPD2, RPSA, RPS28, RPS6, RPS26, RPS12, RPS3A, RPS27A, RPS17, RPS23"
"1342","REACTOME_SARS_COV_2_TARGETS_HOST_INTRACELLULAR_SIGNALLING_AND_REGULATORY_PATHWAYS",0.384244372990354,0.732118758434548,0.0815265143256594,0.500858020509669,1.07468762527215,11,"AKT3, YWHAH, CAV1, YWHAQ, YWHAZ, YWHAB, PDPK1"
"1343","REACTOME_SARS_COV_2_TARGETS_PDZ_PROTEINS_IN_CELL_CELL_JUNCTION",0.327715355805243,0.691268356838278,0.0992333343771191,0.734142427564391,1.146272120306,3,"PATJ, TJP1"
"1344","REACTOME_SARS_COV_INFECTIONS",0.00213590759957347,0.0628463659806703,0.431707695803346,0.387237772489773,1.37535948921178,371,"PATJ, SDC2, ITGB1, RPS13, GANAB, SNRPG, JAK2, RPS27L, NUP188, IKBKG, MAP3K7, GALNT1, RPS24, PPIB, SAP30L, FAU, FXYD1, IRF3, GEMIN2, CUL3, UBE2I, RPS15, TLR2, RPS25, SDC4, NPIPB3, MAN1B1, VPS45, GRB2, KDM1A, CREBBP, CHMP3, CHMP7, SEC24A, RUNX1, HMG20B, ANO1, DDX20, RPS11, RPS15A, IMPDH2, NUP54, UBA52, SNRPD3, GPC1, RPS14, POM121, AKT3, NUP214, HLA-F, HLA-A, RPS27, RBX1, ZDHHC11, NUP107, RPS16, RBBP7, NUP35, EP300, POM121C, ST6GAL1, EEF1A1, KEAP1, STAT2, SIGMAR1, IFNGR2, ATP1A1, IL17RA, GPC4, MAP1LC3B, PPIH, RNF135, RPS9, RPS4X, SNRPD2, SRPK1, RPSA, DAD1, RPS28, JAK1, YWHAH, VHL, PARP14, NFKB1, CHMP4C, ST3GAL4, UBB, MASP2, RPS6, SEC24D, RPN1, AP2A2, STAT1, PARP8, AP2A1, ST3GAL3, CHMP6, MASP1, SAP30, PLCG2, NUP43, RPS26, NUP133, CAV1, EDEM2, CNBP, FURIN, CSNK1A1, HLA-C, CHMP2A, TAB3, SP1, ISCU, DDX5, RPS12, SEC13, HDAC1, PIK3R4"
