"","pathway","pval","padj","log2err","ES","NES","size","leadingEdge"
"836","REACTOME_MITOCHONDRIAL_CALCIUM_ION_TRANSPORT",0.0937972768532526,0.431915311982086,0.178219874951973,0.550766890095009,1.35347739835514,21,"AKAP1, VDAC2, SPG7, PMPCB, VDAC3, VDAC1, STOML2, MICU2, SMDT1, MICU3"
"837","REACTOME_MITOCHONDRIAL_FATTY_ACID_BETA_OXIDATION",0.318696883852691,0.679657733290281,0.0847985102819124,0.410331373338184,1.11446636058388,35,"ACADVL, ACOT2, ECI1, ACBD6, MECR, ACADL, ACAA2"
"838","REACTOME_MITOCHONDRIAL_FATTY_ACID_BETA_OXIDATION_OF_SATURATED_FATTY_ACIDS",0.118971061093248,0.480311074553204,0.161978948883402,0.624965061873637,1.34098325417568,11,"ACADVL, MECR, ACADL"
"839","REACTOME_MITOCHONDRIAL_FATTY_ACID_BETA_OXIDATION_OF_UNSATURATED_FATTY_ACIDS",0.151724137931034,0.524687457068279,0.147331213699377,0.709697558293795,1.31008070571967,6,"ECI1, ACADL, ACADM"
"840","REACTOME_MITOCHONDRIAL_IRON_SULFUR_CLUSTER_BIOGENESIS",0.581578947368421,0.800174459522417,0.0857844408075645,-0.400062999003831,-0.909431325007202,11,"GLRX5, FDX1"
"841","REACTOME_MITOCHONDRIAL_PROTEIN_DEGRADATION",0.00773061460269019,0.142961431737454,0.407017918923954,0.465473942820731,1.48502173631134,94,"UQCRQ, GLUD1, IDH3A, PRKACA, MRPS2, ACOT2, ECI1, ECH1, SPG7, ALDH1B1, COX5A, ATP5MG, SLC25A5, ATP5PF, ACAT1, COX5B, OXCT1, ATP5F1A, FH, TIMM22, CHCHD2, ALDH18A1, SLC25A6, ATP5PD, IDH2, TIMM9, OGDH, MRPS10, MICU2"
"842","REACTOME_MITOCHONDRIAL_PROTEIN_IMPORT",0.0542328042328042,0.353097953400945,0.222056046145248,0.464293643936033,1.38523514126121,58,"TOMM7, CYC1, SLC25A12, COX17, GFER, PMPCB, TOMM20, ATP5MC1, VDAC1, MTX1, ATP5F1A, GRPEL1, TIMM22, CHCHD2, SLC25A6, TIMM9, SLC25A13, TIMM23, CHCHD10, ATP5F1B, PITRM1, GRPEL2, TOMM22, TIMM21, TIMM50, PMPCA, CMC2"
"843","REACTOME_MITOCHONDRIAL_RNA_DEGRADATION",0.565943238731219,0.800174459522417,0.0637845390312975,0.472745685020966,0.954603368510587,9,"REXO2, FASTK, FASTKD2"
"844","REACTOME_MITOCHONDRIAL_TRANSLATION",0.00336051892188669,0.0830487265253921,0.431707695803346,0.486867767446588,1.54400270032732,90,"MRPL41, CHCHD1, MRPS2, MRPL54, MTFMT, GFM1, MRPL22, MRPS27, MRPL51, MRPL40, MRPL13, MRPS33, MRPS34, MRPL24, MRPL37, MRPL36, MRPL15, MRPS22, MRPS31, MRPL46, MRPL2, ERAL1, MRPS12, MRPS10, MRPL49, MRPL11, DAP3, MTIF2, MRPS26, MRPL9, MRPL23, MRPS15, MRPL17"
"845","REACTOME_MITOCHONDRIAL_TRNA_AMINOACYLATION",0.376068376068376,0.724570960186765,0.117249716749792,-0.398398143898139,-1.06438239740733,17,"WARS2, YARS2, AARS2, PPA2, CARS2, PARS2"
"846","REACTOME_MITOCHONDRIAL_UNCOUPLING",0.808771929824561,0.896569648898747,0.0493910105981501,0.413538507222712,0.734898165364809,5,"SLC25A27, SLC25A4"
"847","REACTOME_MITOPHAGY",0.00564074417330184,0.119418681522585,0.407017918923954,0.581489534349187,1.57933457486237,35,"TOMM7, ULK1, UBE2D2, VDAC2, OPTN, UBA52, PRKN, UBE2L3, TOMM20, VDAC3, MAP1LC3B, VDAC1, ATG5, MFN1, CSNK2A2, UBB"
"848","REACTOME_MITOTIC_G1_PHASE_AND_G1_S_TRANSITION",0.300236406619385,0.659760002393991,0.0782955249944794,0.325824714951151,1.08066109972023,135,"ORC2, JAK2, CDKN2D, CDK7, PSMD5, PSMD8, PSMC2, CDKN1C, PSMB7, LYN, UBA52, AKT3, CDK6, PSMB6, LIN9, PSMD13, CDK2, PRIM2, CDKN1B, ABL1, MCM5, UBB, PSME1, PSMA4, RBL2, PSMD12, TFDP2, POLA2, RPA2, PSMB1, LIN54, HDAC1, PSMD14, RPS27A, RPA1, PCNA, PSMD6, RBBP4, PSMF1, E2F4, PSMB4, CCNH, CUL1, PSMD11, CDKN2A, PPP2R1A"
"849","REACTOME_MITOTIC_G2_G2_M_PHASES",0.046029919447641,0.32317120871011,0.224966093540314,0.377934870331825,1.27874748528224,175,"LCMT1, CKAP5, PRKAR2B, TUBG2, PRKACA, ODF2, DCTN2, CDK7, NDE1, CEP78, PSMD5, CEP63, OPTN, CEP192, PSMD8, PSMC2, CEP76, HAUS6, CEP57, CDK5RAP2, PSMB7, SDCCAG8, UBA52, RBX1, SSNA1, PSMB6, PAFAH1B1, LIN9, EP300, CEP135, PSMD13, TUBB4A, TUBG1, TUBA4A, CDK2, UBB, PSME1, PSMA4, FBXW11, PSMD12, PSMB1, CEP72, HAUS8, CEP131, LIN54, HAUS7, PSMD14, TUBB4B, RPS27A, TUBA1C, PPME1, PSMD6, RBBP4, ACTR1A, PSMF1, CDC25B, PCNT, PLK1, PSMB4, TUBGCP4, CCNH, CUL1, HAUS2, PSMD11, NINL, PPP2R1A, DYNC1I2"
"850","REACTOME_MITOTIC_METAPHASE_AND_ANAPHASE",0.0736961451247165,0.392443275878859,0.173747838999571,0.358537453747727,1.23173620415893,208,"LBR, CKAP5, CLIP1, NDEL1, NUP188, UBE2E1, NDE1, PSMD5, ANAPC4, UBE2I, PSMD8, PSMC2, SMC3, EMD, STAG1, CHMP3, CHMP7, PSMB7, NUP54, UBA52, POM121, RPS27, NUP107, RAD21, PSMB6, PAFAH1B1, NUP35, ANAPC1, PPP2R5A, PSMD13, CDC26, TUBB4A, BANF1, ANAPC7, HDAC8, TUBA4A, ANAPC5, TAOK1, CHMP4C, UBB, RCC1, VPS4A, PSME1, PDS5B, PSMA4, PPP2R5E, KNL1, CHMP6, NUP43, NUP133, PSMD12, ANAPC16, CHMP2A, ANAPC11, PSMB1, SEC13, PSMD14, TUBB4B, RPS27A, TUBA1C, BUB3, PSMD6, PSMF1, DSN1, ANKLE2, NUP93, ZWILCH, PLK1, PSMB4, CENPP, IST1, PDS5A, PSMD11, PPP2R1A, DYNC1I2, CC2D1B, NUP58, SEM1"
"851","REACTOME_MITOTIC_PROMETAPHASE",0.0513112884834664,0.343924311997288,0.211400189384923,0.372776585680617,1.26533707034593,177,"CKAP5, PRKAR2B, CLIP1, TUBG2, PRKACA, NDEL1, ODF2, DCTN2, NDE1, CEP78, CEP63, NEK9, CEP192, SMC3, CEP76, STAG1, HAUS6, NCAPD2, CEP57, CDK5RAP2, SDCCAG8, RPS27, SSNA1, NUP107, RAD21, PAFAH1B1, PPP2R5A, CEP135, TUBB4A, TUBG1, HDAC8, TUBA4A, TAOK1, NUMA1, CSNK2A2, PDS5B, PPP2R5E, KNL1, NUP43, NUP133, CEP72, HAUS8, CEP131, SEC13, HAUS7, TUBB4B, TUBA1C, BUB3"
"852","REACTOME_MITOTIC_PROPHASE",0.215384615384615,0.595518222865037,0.101713902282311,0.374612392847622,1.1630111764897,77,"RAB1B, NUP188, GORASP2, GOLGA2, SET, NEK9, EMD, NUP54, POM121, NUP214, NUP107, NUP35, POM121C, ENSA, BANF1, MCPH1, NUMA1, GORASP1, MAPK3"
"853","REACTOME_MITOTIC_SPINDLE_CHECKPOINT",0.48811013767209,0.783577712609971,0.0571258510018113,0.30753433975696,0.983220298853052,98,"CKAP5, CLIP1, NDEL1, UBE2E1, NDE1, ANAPC4, RPS27, NUP107, PAFAH1B1, ANAPC1, PPP2R5A, CDC26, ANAPC7, ANAPC5, TAOK1, PPP2R5E, KNL1, NUP43, NUP133, ANAPC16, ANAPC11, SEC13"
"854","REACTOME_MITOTIC_TELOPHASE_CYTOKINESIS",0.0201302850945233,0.213140525533693,0.352487857583619,0.707652264606414,1.54991650448742,12,"SMC3, STAG1, MAU2, RAD21, KIF23, PDS5B, PLK1, PDS5A"
"855","REACTOME_MODULATION_BY_MTB_OF_HOST_IMMUNE_SYSTEM",0.288364249578415,0.651823355817875,0.100633389423036,0.618914293631797,1.19139965789338,7,"TLR2, UBA52, UBB, RPS27A, B2M"
"856","REACTOME_MOLECULES_ASSOCIATED_WITH_ELASTIC_FIBRES",0.106534090909091,0.458203490847169,0.160801401070022,0.496010808610365,1.33928811701439,34,"TGFB2, FBN1, ITGB1, LTBP2, LTBP1, ITGA8, LTBP3, ITGB5, FBLN1, LTBP4, FN1, EMILIN1"
"857","REACTOME_MOLYBDENUM_COFACTOR_BIOSYNTHESIS",0.585308056872038,0.800174459522417,0.0797705918628453,-0.471170231749002,-0.921266540799471,6,"GPHN, MOCS2"
"858","REACTOME_MRNA_CAPPING",0.15429403202329,0.527272518882738,0.132846300606183,0.491442815232728,1.27267670101586,28,"RNGTT, CDK7, GTF2F1, GTF2H2, POLR2H, POLR2C, GTF2H3, POLR2I, POLR2B, CCNH, POLR2G, NCBP1, POLR2D, ERCC3"
"859","REACTOME_MRNA_DECAY_BY_3_TO_5_EXORIBONUCLEASE",0.369426751592357,0.724570960186765,0.083129129135339,0.500532626849714,1.09627824030252,12,"EXOSC1, NT5C3B, EXOSC5, DCPS, HBS1L"
"860","REACTOME_MRNA_DECAY_BY_5_TO_3_EXORIBONUCLEASE",0.199044585987261,0.572544260045909,0.120985142145252,0.538598087756178,1.22515657231738,15,"DDX6, DCP2, PATL1, XRN1, LSM3, LSM7, LSM2"
"861","REACTOME_MRNA_EDITING",0.931578947368421,0.962611520653422,0.0429311093452583,0.329432079809653,0.585432860147276,5,"ADARB1, APOBEC1"
"862","REACTOME_MRNA_EDITING_C_TO_U_CONVERSION",0.99438202247191,0.995528945219859,0.0429311093452583,0.272729510951865,0.42583322125378,3,"APOBEC1, APOBEC3H"
"863","REACTOME_MRNA_SPLICING",0.00249558891884114,0.0698764897275518,0.431707695803346,0.42755619562409,1.46831932020903,206,"MAGOH, WBP4, UBL5, SNRPG, CCAR1, SUGP1, SRSF11, HNRNPA2B1, U2AF1, GTF2F1, CACTIN, EFTUD2, SRRM1, FAM32A, U2AF2, SF3B6, PRPF3, IK, PHF5A, SYF2, TXNL4A, SNRPD3, SRRT, GPKOW, PRCC, SNU13, LSM3, SNRPC, CDC5L, PUF60, DDX46, GCFC2, SRRM2, FAM50A, POLR2H, PRPF31, SNRPB2, LSM7, SRSF5, PPIH, SNRPA, MTREX, WBP11, ACIN1, CCDC12, SNRPD2, RBM25, TRA2B, HNRNPH1, ALYREF, LUC7L3, BUD13, POLR2C, PRPF6, SNRNP200, POLR2I, PRKRIP1, DHX8, LSM2, PNN, EIF4A3, HNRNPU, SNW1, SMNDC1, SRSF2, POLR2B, SF3B5, U2SURP, GPATCH1, DDX5, CASC3, ZNF830, PRPF8, DHX15, SNRPN, YBX1, SNRNP70, CDC40, RBM8A, SRSF8, MAGOHB, SNRNP40, SNRNP25, SF3B4, RBM10, RBM5, PCBP2, POLR2G, PRPF4B, LSM8"
"864","REACTOME_MRNA_SPLICING_MINOR_PATHWAY",0.458839406207827,0.771932944995331,0.0636424081651019,0.347569713709424,1.00638994870739,50,"SNRPG, GTF2F1, EFTUD2, SF3B6, TXNL4A, SNRPD3, POLR2H, SNRPD2, POLR2C, PRPF6, SNRNP200, POLR2I, SRSF2, POLR2B, SF3B5, PRPF8, YBX1, SNRNP40, SNRNP25, SF3B4, POLR2G"
"865","REACTOME_MTORC1_MEDIATED_SIGNALLING",0.00170364970938606,0.0528131409909677,0.45505986738723,0.686026236683161,1.71730360080522,23,"RRAGC, RHEB, SLC38A9, MTOR, RPS6, EIF4B, EIF4G1, EIF4E, EEF2K, LAMTOR2"
"866","REACTOME_MTOR_SIGNALLING",0.0180740645804534,0.210105424479297,0.352487857583619,0.54514854140452,1.50506565583758,39,"RRAGC, RHEB, SLC38A9, PRKAA1, PRKAB1, STRADB, STRADA, MTOR, RPS6, EIF4B, EIF4G1, EIF4E, EEF2K, LAMTOR2, PRKAG2"
"867","REACTOME_MUCOPOLYSACCHARIDOSES",0.437299035369775,0.756474103585657,0.0747385227439092,0.483019253100527,1.03641110418299,11,"GUSB, IDS, HYAL1, GLB1"
"868","REACTOME_MULTIFUNCTIONAL_ANION_EXCHANGERS",0.126475548060708,0.486451966061491,0.160801401070022,0.700097220775805,1.34767543407329,7,"SLC26A6, SLC26A3, SLC26A2"
"869","REACTOME_MUSCARINIC_ACETYLCHOLINE_RECEPTORS",0.333333333333333,0.693839972022582,0.110564716336619,-0.65985401459854,-1.16576393892133,4,"CHRM1, CHRM2, CHRM5, CHRM3"
"870","REACTOME_MUSCLE_CONTRACTION",0.00848382429641371,0.146781288509543,0.380730400722792,0.413908583812727,1.40367873122724,176,"TPM2, MYL9, LMOD1, SORBS1, CES1, TMOD1, PLN, MYL6, ACTG2, ACTA2, PRKACA, ITPR1, RYR1, SORBS3, CASQ2, FXYD1, DMD, DES, RYR2, MYH11, AHCYL1, TPM1, CACNB2, TLN1, MYL12A, VIM, TNNC1, ACTC1, ITGB5, ATP1A1, MYL6B, RANGRF, CAMK2B, KCNK2, KCNQ1, ATP2A2, KCNK1, KCNA5, CALD1"
"871","REACTOME_MYD88_INDEPENDENT_TLR4_CASCADE",0.74125,0.871482172300528,0.0378487722705029,0.268468523527878,0.85995008825594,102,"IKBIP, MAP2K7, IKBKG, MAP3K7, IRF3, UBE2D2, OPTN, BIRC2, UBA52, HMGB1, TANK, MAP2K6, MAP2K1, NFKB1, MAPK3, UBB, TICAM1, FBXW11, NFKBIB, TAB3, TIFA, FOS, USP14, IRAK2, RPS6KA2, RPS27A"
"872","REACTOME_MYOCLONIC_EPILEPSY_OF_LAFORA",0.0484140233722871,0.332200571439883,0.266350657088526,0.722423782196615,1.45877201596555,9,"PPP1R3C, UBA52, GYG1, UBB, RPS27A, GYS1"
"873","REACTOME_MYOGENESIS",0.266871165644172,0.628613763308388,0.148261500475107,-0.42198463540115,-1.18382614710215,23,"CDH2, BNIP2, MAPK11, MEF2C, CTNNA2, TCF4, MAPK14, TCF3, MEF2A, MAPK12"
"874","REACTOME_M_DECAY_DEGRADATION_OF_MATERNAL_MRNAS_BY_MATERNALLY_STORED_FACTORS",0.0509461426491994,0.34280040170159,0.241339976815091,0.55552602713157,1.43863133130442,28,"EIF4A1, PAIP1, ZFP36L2, EIF4A2, EIF4B, EIF4G1, PABPC1, EIF4A3, CNOT6, EIF4E, TNKS1BP1, DICER1, CNOT8, RPS2, PAIP2, POLR2D, CNOT3"
"875","REACTOME_M_PHASE",0.00539104345657007,0.115541375809946,0.407017918923954,0.385047372033421,1.35697605747702,321,"LBR, CKAP5, PRKAR2B, CLIP1, TUBG2, RAB1B, PRKACA, NDEL1, ODF2, NUP188, GORASP2, DCTN2, UBE2E1, GOLGA2, NDE1, CEP78, PSMD5, CEP63, SET, ANAPC4, NEK9, UBE2I, CEP192, PSMD8, PSMC2, SMC3, CEP76, EMD, STAG1, HAUS6, CHMP3, CHMP7, NCAPD2, CEP57, CDK5RAP2, PSMB7, MAU2, NUP54, SDCCAG8, UBA52, POM121, NUP214, RPS27, SSNA1, NUP107, RAD21, PSMB6, PAFAH1B1, NUP35, ANAPC1, POM121C, PPP2R5A, ENSA, CEP135, PSMD13, KIF23, CDC26, TUBB4A, BANF1, TUBG1, MCPH1, ANAPC7, HDAC8, TUBA4A, ANAPC5, TAOK1, NUMA1, GORASP1, MAPK3, CHMP4C, CSNK2A2, UBB, RCC1, VPS4A, PSME1, PDS5B, PSMA4, PPP2R5E, KNL1, CHMP6, NUP43, NUP133, PSMD12, ANAPC16, CHMP2A, USO1, ANAPC11, PSMB1, CEP72, HAUS8, CEP131, SEC13, HAUS7, PSMD14, TUBB4B, RPS27A, TUBA1C, BUB3"
"876","REACTOME_NADE_MODULATES_DEATH_SIGNALLING",0.772511848341232,0.882870683818551,0.0656813601934011,-0.387221298686778,-0.757123439315844,6,"CASP3"
"877","REACTOME_NA_CL_DEPENDENT_NEUROTRANSMITTER_TRANSPORTERS",0.705882352941177,0.852607788595271,0.0762797180809272,-0.34250511311666,-0.808898727302532,12,"SLC6A6, SLC6A12, SLC6A7, SLC6A1, SLC6A20"
"878","REACTOME_NCAM1_INTERACTIONS",0.18854748603352,0.565487662531556,0.115734447701689,0.44779006178766,1.23627487158935,39,"COL6A2, COL5A2, COL6A1, CACNB2, COL4A2, COL4A1, PSPN, COL6A3"
"879","REACTOME_NCAM_SIGNALING_FOR_NEURITE_OUT_GROWTH",0.588313413014608,0.800174459522417,0.051218434854034,0.309888282363185,0.926934540248421,59,"COL6A2, COL5A2, GRB2, COL6A1, CACNB2, COL4A2, COL4A1, PSPN, MAPK3, COL6A3"
"880","REACTOME_NECTIN_NECL_TRANS_HETERODIMERIZATION",0.777586206896552,0.885225194132873,0.0503964322442957,0.407747630078587,0.752690067376196,6,"NECTIN1, PVR, NECTIN2"
"881","REACTOME_NEDDYLATION",0.0727069351230425,0.39077163892756,0.173747838999571,0.35607412592075,1.2327466676734,224,"ZBTB16, FBXO17, FBXL12, OBSL1, FBXW5, COMMD6, PSMD5, KLHL42, UBE2D2, CUL3, PSMD8, PSMC2, COPS6, KLHL20, FBXO32, ASB13, CUL9, CUL7, PSMB7, UBA52, PALB2, NAE1, RBX1, PSMB6, RBBP7, MUL1, PSMD13, FBXL3, COPS2, KEAP1, KLHL2, ERCC8, KLHL3, CCDC8, NPLOC4, KLHL9, NUB1, DDB2, COMMD9, FBXL19, BTBD6, VHL, UBE2M, FBXL22, UBB, UBXN7, ANKRD9, DCAF6, DCUN1D2, PSME1, PSMA4, COPS3, ELOB, COMMD1, FBXW11, PSMD12, COMMD5, DDA1, PSMB1, FBXO31, KLHL22, FBXL4, COPS4, PSMD14, ASB3, RPS27A, ASB8, SOCS3, PSMD6, WSB1, CUL4A, PSMF1, BTBD1, KLHL13, KLHL21, COP1, GPS1, PSMB4, CUL1, COPS8, CCDC22, CAND1, PSMD11"
"882","REACTOME_NEF_AND_SIGNAL_TRANSDUCTION",0.0287143911003397,0.249240914750949,0.352487857583619,-0.767812055231895,-1.55761027433148,7,"ELMO1, FYN"
"883","REACTOME_NEF_MEDIATED_CD4_DOWN_REGULATION",0.363486842105263,0.720334655130978,0.0857844408075645,0.565722057520669,1.13181000978978,8,"AP2A2, AP2A1, ARF1, AP2M1, ATP6V1H, AP2S1, AP2B1"
"884","REACTOME_NEF_MEDIATED_CD8_DOWN_REGULATION",0.48448275862069,0.783577712609971,0.0730744399126987,0.555532380853061,1.02549634707468,6,"AP2A2, AP2A1, AP2M1, ATP6V1H, AP2S1, AP2B1"
"885","REACTOME_NEF_MEDIATED_DOWNREGULATION_OF_MHC_CLASS_I_COMPLEX_CELL_SURFACE_EXPRESSION",0.195325542570952,0.567032009871525,0.12563992130984,0.619528326371063,1.25099783240817,9,"HLA-A, AP1G1, AP1M1, AP1S3, B2M, AP1S2"
"886","REACTOME_NEF_MEDIATES_DOWN_MODULATION_OF_CELL_SURFACE_RECEPTORS_BY_RECRUITING_THEM_TO_CLATHRIN_ADAPTERS",0.0967741935483871,0.435233160621762,0.176694268938498,0.583854610195925,1.36973855502699,17,"HLA-A, AP1G1, AP1M1, AP1S3, AP2A2, AP2A1, ARF1, B2M"
"887","REACTOME_NEGATIVE_EPIGENETIC_REGULATION_OF_RRNA_EXPRESSION",0.1,0.443989769820972,0.16440575583821,0.468679988996086,1.32113493001105,45,"SIRT1, CDK7, SAP30L, POLR1C, GTF2H2, SMARCA5, UBTF, POLR2H, RRP8, GTF2H3, SAP30, SAP30BP, HDAC1, POLR1B, TAF1A, MBD2, CCNH"
"888","REACTOME_NEGATIVE_FEEDBACK_REGULATION_OF_MAPK_PATHWAY",0.332758620689655,0.693839972022582,0.0934449219410994,0.623968971764138,1.1518282701172,6,"MAP2K1, MAPK3, RAF1, MAP2K2, MAPK1"
"889","REACTOME_NEGATIVE_REGULATION_OF_ACTIVITY_OF_TFAP2_AP_2_FAMILY_TRANSCRIPTION_FACTORS",0.344013490725126,0.702596964586847,0.0902635484340068,0.590940256216656,1.13755010400648,7,"UBE2I, KCTD1, WWOX"
"890","REACTOME_NEGATIVE_REGULATION_OF_FGFR1_SIGNALING",0.466863033873343,0.774349651740974,0.0670512579829467,0.391728868908315,0.995967847435707,26,"GRB2, UBA52, FGF2, MKNK1, MAPK3, UBB, FGF17, RPS27A"
"891","REACTOME_NEGATIVE_REGULATION_OF_FGFR2_SIGNALING",0.586156111929308,0.800174459522417,0.0561766586307176,0.361982838756506,0.920338778527362,26,"GRB2, UBA52, FGF2, MKNK1, MAPK3, UBB, FGF17, RPS27A"
"892","REACTOME_NEGATIVE_REGULATION_OF_FGFR3_SIGNALING",0.449704142011834,0.770286246657409,0.069119845655101,0.40898723870479,1.0238023273088,23,"GRB2, UBA52, FGF2, MKNK1, MAPK3, UBB, FGF17, RPS27A"
"893","REACTOME_NEGATIVE_REGULATION_OF_FGFR4_SIGNALING",0.497041420118343,0.786367558239862,0.0642140881844605,0.396552041261862,0.992673766615975,23,"GRB2, UBA52, FGF2, MKNK1, MAPK3, UBB, FGF17, RPS27A"
"894","REACTOME_NEGATIVE_REGULATION_OF_FLT3",0.968354430379747,0.976227230626737,0.0363783055518278,0.23224383779789,0.525461646964805,14,"UBA52, UBB, RPS27A, CBL, FLT3"
"895","REACTOME_NEGATIVE_REGULATION_OF_MAPK_PATHWAY",0.719858156028369,0.860064527780625,0.0905428948469474,-0.268088337801604,-0.865448654150962,42,"PPP2R5B, PPP2R1B, DUSP6, KRAS, PPP2R5D, DUSP5, MAPK12"
"896","REACTOME_NEGATIVE_REGULATION_OF_MET_ACTIVITY",0.568835098335855,0.800174459522417,0.0588438169595807,0.376956318770676,0.926348091722167,21,"HGS, GRB2, UBA52, EPS15, UBB, HGF, RPS27A"
"897","REACTOME_NEGATIVE_REGULATION_OF_NMDA_RECEPTOR_MEDIATED_NEURONAL_TRANSMISSION",0.504398826979472,0.786806105905449,0.10027910675413,-0.34481666365666,-0.954789972583559,21,"CAMK2A, GRIN1, GRIN2B, DLG4, CAMK2D, GRIN2A"
"898","REACTOME_NEGATIVE_REGULATION_OF_NOTCH4_SIGNALING",0.272237196765499,0.635636977460034,0.0908241419007155,0.392171284319977,1.13733792835498,51,"PSMD5, PSMD8, PSMC2, PSMB7, UBA52, RBX1, PSMB6, PSMD13, UBB, PSME1, PSMA4, PSMD12, PSMB1, PSMD14, RPS27A, PSMD6, PSMF1, PSMB4, CUL1, PSMD11, SEM1"
"899","REACTOME_NEGATIVE_REGULATION_OF_TCF_DEPENDENT_SIGNALING_BY_DVL_INTERACTING_PROTEINS",0.394736842105263,0.733672641286847,0.0847985102819124,0.619000041552957,1.10002330364128,5,"DVL2, CXXC4"
"900","REACTOME_NEGATIVE_REGULATION_OF_TCF_DEPENDENT_SIGNALING_BY_WNT_LIGAND_ANTAGONISTS",0.333876221498371,0.693839972022582,0.0899860794997137,0.542987762784547,1.13214576628106,10,"LRP5, WNT9A, SFRP1, SFRP2"
"901","REACTOME_NEGATIVE_REGULATION_OF_THE_PI3K_AKT_NETWORK",0.218274111675127,0.598615889206983,0.216542836735348,-0.292141578868962,-1.09305131090448,97,"FYN, PIK3R3, FGF18, PPP2R5B, PPP2R1B, KL, IL33, PPP2R5D, ERBB4, PDGFA, TGFA, ERBB2, MET, FGF10, BDNF, PHLPP2, PIP4K2B, PIP5K1A, IRS1, ESR1, GAB1, PIP4K2C, ESR2, IRAK4, PIP5K1C"
"902","REACTOME_NEGATIVE_REGULATORS_OF_DDX58_IFIH1_SIGNALING",0.0980113636363636,0.43739775648516,0.16823816568964,0.499515956553276,1.34875243292612,34,"IRF3, UBE2D2, UBA52, RNF135, ATG5, HERC5, UBB, UBE2K, PIN1, RPS27A, TAX1BP1, MAVS, PCBP2"
"903","REACTOME_NEPHRIN_FAMILY_INTERACTIONS",0.508823529411765,0.786806105905449,0.0999276973731092,-0.356850269111011,-0.964661521353685,18,"FYN, NCK2, ACTN4, SPTAN1"
"904","REACTOME_NEPHRON_DEVELOPMENT",0.180412371134021,0.554328984581699,0.166933848713193,-0.562508953343912,-1.27318824313479,10,"LFNG, DLL1"
"905","REACTOME_NERVOUS_SYSTEM_DEVELOPMENT",0.00128358997654508,0.0471841917826444,0.45505986738723,0.369068280040646,1.33165625867444,539,"MYL9, MAGOH, COL6A2, DPYSL3, UPF3A, SDC2, ACTB, COL5A2, PFN1, MYL6, SLIT2, NCSTN, ITGB1, RPS13, RPS6KA6, PRKACA, CNTN6, RPS27L, RPL18, NEO1, RPS24, RPL23, RPL10, VAV3, RPL13A, PSMD5, FAU, EPHA3, RPL3, ROBO1, RPL7A, RPS15, MYH11, RPS25, SHTN1, PSMD8, RPL14, RPL34, GRB2, RRAS, COL6A1, PSMC2, RPL41, PLXNB1, CLTCL1, RPS6KA4, LAMC1, NTN4, ARPC5, NAB2, RPL12, LDB1, FARP2, EPHB6, RPS11, DOK4, RPS15A, NTN1, NELL2, PSMB7, LYN, UPF2, UBA52, RPL19, RPL10A, GPC1, RPS14, CACNB2, RPL7, TLN1, APH1B, COL4A2, PIK3R1, RPS27, RPL23A, ACTG1, RHOB, RBX1, MYL12A, UNC5D, EFNA5, RPL37, RPS16, PSMB6, CNTNAP1, VASP, SRGAP1, SEMA4D, PSMD13, CAP1, MAP2K1, CDC42, COL4A1, TUBB4A, KALRN, NUMB, DAG1, RPLP1, PSEN1, RPS9, RPS4X, DLG3, PLXNC1, RPL30, PSEN2, RPL22, TUBA4A, PSPN, NAB1, RPSA, GAB2, RPS28, MAPK3, CSNK2A2, SMARCA4, ABL1, UBB, RPS6, COL6A3, PSME1, AP2A2, PSMA4, CLTA, RPL37A, ELOB, IRS2, SDCBP, CD24, AP2A1, RGMB, EIF4G1, PABPC1, WASL, RPL4, DOK1, MYO9B, RPS26, PSMD12, EIF4A3, RPL38, RPL22L1, EPHA7, RPL39, YAP1, MAP2K2, EPHA6, PSMB1, VAV2, RPL18A, RPS12, CASC3, SEMA3A, ITGA5, PAK2, PSMD14, TUBB4B, RPS3A, RPS6KA2, RPS27A, TUBA1C, PLXNA1, COL3A1, RPLP2, RPLP0, PSMD6, PRKAR2A, RPS17, RPS23, PSMF1, RBM8A, RPL32, RPL24, MAGOHB, ACTR2, CACNA1H, CACNA1D, ABLIM2"
"906","REACTOME_NETRIN_1_SIGNALING",0.75103734439834,0.874771435631332,0.0419081748591401,0.294241527376471,0.827736346871422,44,"SLIT2, NEO1, ROBO1, NTN4, NTN1, UNC5D, CDC42"
"907","REACTOME_NETRIN_MEDIATED_REPULSION_SIGNALS",0.516447368421053,0.790610786224821,0.0675188953767744,0.489662770004537,0.979642241530028,8,"NTN1, UNC5D, UNC5C"
"908","REACTOME_NEUREXINS_AND_NEUROLIGINS",0.00104048970081843,0.0440558566005071,0.45505986738723,-0.518251864779738,-1.75452226189995,53,"NRXN1, EPB41, EPB41L2, NLGN4X, APBA2, HOMER2, SYT2, SYT7, GRIN1, GRIN2B, DLGAP1, GRM5, SHANK2, STX1A, DLG4, APBA1"
"909","REACTOME_NEUROFASCIN_INTERACTIONS",0.718826405867971,0.859423306189254,0.0707899094502623,-0.400105761235496,-0.81166848094278,7,"ANK1, NRCAM, DCX"
"910","REACTOME_NEURONAL_SYSTEM",0.000725336355482549,0.0370348209740501,0.477270815362862,-0.311840896734857,-1.37531697808801,355,"RASGRF2, PTPRD, NRXN1, SLC1A1, EPB41, SNAP25, GIT1, GNAI2, SYN2, EPB41L2, PRKAA2, NLGN4X, ADCY4, APBA2, HOMER2, KCNC2, PLCB1, PPFIA3, GRIA4, ALDH2, KRAS, PPFIBP1, KCNQ2, CHRNA5, SYT2, TUBB2B, SYT7, KCNJ2, GRIA2, GABRB1, CACNG8, GABRB3, GNG4, CAMK2A, KCNC4, GRIN1, ADCY1, GRIA3, GABRG2, ABCC8, GRIN2B, KCNJ12, BCHE, CACNG3, TSPOAP1, KCNN3, DLGAP1, TUBA1B, GRM5, KCNH5, KCND2, KCNS3, SHANK2, STX1A, ERBB4, RASGRF1, KIF17, DLG4, SLITRK1, APBA1, GABRA1, KCNH7, KCNQ3, KCNJ9, KCNA1, GRIP1, KCNB1, TSPAN7, CAMK2D, GNB1, ADCY7, KCNAB2, GRIN2A, MYO6, KCNK6, PRKAR1B, GNG11, PRKCB, TUBB2A, KCNK7, KCNF1, GRIP2, SLC6A12, NSF, LRRTM4, SLC1A3, DLGAP2, KCNH3, SLC1A2, GRIK2, PLCB2, GNB4, GABRB2, SLITRK3"
"911","REACTOME_NEUROTOXICITY_OF_CLOSTRIDIUM_TOXINS",0.0176392985250864,0.208849900670521,0.352487857583619,-0.737976938483016,-1.6379681902398,9,"SNAP25, SYT2, SV2A, STX1A, SV2B"
"912","REACTOME_NEUROTRANSMITTER_CLEARANCE",0.75,0.87441235728677,0.0498907356726307,0.383358764050739,0.766965474874408,8,"MAOA, ACHE"
"913","REACTOME_NEUROTRANSMITTER_RECEPTORS_AND_POSTSYNAPTIC_SIGNAL_TRANSMISSION",0.0320250744414276,0.263228224056455,0.321775918075361,-0.307640120939486,-1.23581868008812,176,"RASGRF2, GIT1, GNAI2, PRKAA2, ADCY4, PLCB1, GRIA4, KRAS, CHRNA5, TUBB2B, KCNJ2, GRIA2, GABRB1, CACNG8, GABRB3, GNG4, CAMK2A, GRIN1, ADCY1, GRIA3, GABRG2, GRIN2B, KCNJ12, CACNG3, TUBA1B, ERBB4, RASGRF1, KIF17, DLG4, APBA1, GABRA1, KCNJ9, GRIP1, TSPAN7, CAMK2D, GNB1, ADCY7, GRIN2A, MYO6, PRKAR1B, GNG11, PRKCB, TUBB2A, GRIP2, NSF, GRIK2, PLCB2, GNB4, GABRB2"
"914","REACTOME_NEUROTRANSMITTER_RELEASE_CYCLE",0.277372262773723,0.640316819381892,0.159646701919906,-0.332531533708881,-1.09003599428171,47,"SLC1A1, SNAP25, SYN2, PPFIA3, TSPOAP1, STX1A, APBA1"
"915","REACTOME_NEUTROPHIL_DEGRANULATION",0.00981165061940397,0.154845686138957,0.380730400722792,0.365644264235375,1.30097863508373,385,"PA2G4, TRAPPC1, IQGAP1, NCSTN, A1BG, GUSB, GLIPR1, ERP44, PLAU, AGA, APAF1, TCIRG1, CD63, PKM, VAPA, LTA4H, PAFAH1B2, IDH1, TLR2, SNAP29, CTSB, GCA, PSMC2, GDI2, GHDC, PGM2, C1orf35, C3, ARPC5, CXCL1, CPNE3, TOLLIP, COPB1, CYBA, CD47, PSMB7, IMPDH2, RAB7A, QSOX1, PRDX6, SIRPA, ADGRE3, P2RX1, SNAP23, RAB31, HMGB1, ASAH1, ATP8B4, RAP2B, CYSTM1, ENPP4, HEXB, EEF1A1, PSMD13, GYG1, CAP1, TMBIM1, FTH1, RAP2C, RAB37, RAB18, ATG7, PSEN1, AP1M1, PRDX4, FUCA1, PRKCD, MAN2B1, DNAJC13, TXNDC5, PYGB, FRK, UBR4, COMMD9, C5AR1, SLC15A4, S100A11, GSN, NFKB1, NAPRT, SVIP, RAP1A, RHOF, CMTM6, RAB6A, AP2A2, GAA, CST3, SDCBP, LAIR1, FUCA2, OSTF1, RAB3D, CRACR2A, PSMD12, PDAP1, BST1, HLA-C, YPEL5, FCGR2A, NHLRC3, PGRMC1, CHI3L1, TSPAN14, PSMB1, CD53, NIT2, TOM1, DEGS1, ALOX5, LAMTOR2, ATP6V1D, CKAP4, DYNLT1, JUP, DNAJC3, NPC2, RHOG, PSMD14, TUBB4B"
"916","REACTOME_NFE2L2_REGULATES_PENTOSE_PHOSPHATE_PATHWAY_GENES",0.149671052631579,0.520012102874433,0.144630528034484,0.664980678846899,1.33039145041331,8,"CREBBP, EP300, TKT, PGD"
"917","REACTOME_NFE2L2_REGULATING_ANTI_OXIDANT_DETOXIFICATION_ENZYMES",0.175115207373272,0.54739449582983,0.127505315300183,0.535619785561183,1.25657836438467,17,"ATF4, CREBBP, GCLM, EP300, GCLC, SOD3, GSR"
"918","REACTOME_NFE2L2_REGULATING_ER_STRESS_ASSOCIATED_GENES",0.126315789473684,0.486451966061491,0.16440575583821,0.740247272480593,1.31549143057025,5,"ATF4, CREBBP, EP300, MAFK"
"919","REACTOME_NFE2L2_REGULATING_INFLAMMATION_ASSOCIATED_GENES",0.510526315789474,0.786806105905449,0.0713052987340038,0.564320653298274,1.00285271031127,5,"CREBBP, EP300, MAFK"
"920","REACTOME_NFE2L2_REGULATING_MDR_ASSOCIATED_ENZYMES",0.799511002444988,0.893118971061093,0.0655321029282414,-0.356975890004457,-0.724173722163862,7,"ABCG2"
"921","REACTOME_NFE2L2_REGULATING_TUMORIGENIC_GENES",0.784565916398714,0.88777714233616,0.046788296531803,0.354830798728768,0.761358015333768,11,"CREBBP, EP300, SP1, MAFK, EGF, AREG"
"922","REACTOME_NF_KB_ACTIVATION_THROUGH_FADD_RIP_1_PATHWAY_MEDIATED_BY_CASPASE_8_AND_10",0.81687898089172,0.8991253336152,0.0445070537769277,0.337038493808435,0.738189574637786,12,"IKBKG, RNF135, MAVS, CHUK"
"923","REACTOME_NF_KB_IS_ACTIVATED_AND_SIGNALS_SURVIVAL",0.830128205128205,0.900171082443242,0.0440640346597561,0.329496554939281,0.73255237133215,13,"UBA52, NFKB1, UBB, NGFR, RPS27A, RELA, IRAK1"
"924","REACTOME_NGF_INDEPENDANT_TRKA_ACTIVATION",0.435185185185185,0.756237719200682,0.0949751525905595,-0.552826672763142,-1.04645855553409,5,"ADCYAP1R1, NTRK1, ADCYAP1, ADORA2A"
"925","REACTOME_NGF_STIMULATED_TRANSCRIPTION",0.798601398601399,0.893118971061093,0.0395979123961192,0.287067088995713,0.789705863065855,38,"RRAD, MEF2D, NAB2, EP300, NAB1, ID3, EGR3, SRF, FOS, EGR1, ATF2, TRIB1, SH3GL3"
"926","REACTOME_NICOTINAMIDE_SALVAGING",0.109062980030722,0.464052287581699,0.165656695205483,0.575255405423742,1.34956459028759,17,"NNMT, NAXE, PARP14, NAPRT, NAXD, PARP8, PTGIS"
"927","REACTOME_NICOTINATE_METABOLISM",0.418103448275862,0.749188479219439,0.0713052987340038,0.394484588052763,1.02980708639465,29,"NNMT, NAXE, PARP14, NAPRT, NAXD, PARP8, BST1, NMRK2, PTGIS, NADSYN1"
"928","REACTOME_NITRIC_OXIDE_STIMULATES_GUANYLATE_CYCLASE",0.455772113943028,0.77116997057027,0.069119845655101,0.410128438583146,1.00253594838152,20,"KCNMB1, ITPR1, PDE1A, KCNMA1"
"929","REACTOME_NOD1_2_SIGNALING_PATHWAY",0.529745042492918,0.794721014520245,0.0590954798717342,0.35160745381073,0.954971286291709,35,"IKBKG, MAP3K7, BIRC2, UBA52, MAP2K6, UBB, TAB3, IRAK2, RPS27A, CASP9, CHUK, CASP1, AAMP, TNFAIP3, IRAK1"
