"","pathway","pval","padj","log2err","ES","NES","size","leadingEdge"
"412","REACTOME_EGFR_INTERACTS_WITH_PHOSPHOLIPASE_C_GAMMA",0.814720812182741,0.8991253336152,0.066436413766281,-0.356344010367814,-0.753077720067758,8,"TGFA, PLCG1"
"413","REACTOME_EGFR_TRANSACTIVATION_BY_GASTRIN",0.652284263959391,0.830602188256911,0.0776798560117236,-0.407236042811051,-0.860630126301297,8,"KRAS, SOS1"
"414","REACTOME_EGR2_AND_SOX10_MEDIATED_INITIATION_OF_SCHWANN_CELL_MYELINATION",0.935344827586207,0.962611520653422,0.0334561741060507,0.256964574733015,0.670809324436912,29,"LAMC1, NAB2, DAG1, NAB1, SMARCA4, YAP1, MBP, SCD5, LAMA2, PMP22, HMGCR, ADGRG6"
"415","REACTOME_EICOSANOIDS",0.691399662731872,0.847049974948856,0.0547939500773363,0.424584704892206,0.817318451617913,7,"TBXAS1, PTGIS, CYP4F3, CYP4F11, CYP4F12"
"416","REACTOME_EICOSANOID_LIGAND_BINDING_RECEPTORS",0.453525641025641,0.77116997057027,0.0727141077934447,0.461154260083194,1.02526002687985,13,"TBXA2R, PTGER4, PTGIR, PTGDR, LTB4R"
"417","REACTOME_ELASTIC_FIBRE_FORMATION",0.0779944289693593,0.400586771274579,0.188204146308491,0.493036296978267,1.37446401719546,41,"TGFB2, FBN1, ITGB1, LTBP2, LTBP1, ITGA8, LTBP3, ITGB5, LOXL1, FBLN1, LTBP4, FN1, EMILIN1, ELN, FURIN, TGFB3, ITGA5"
"418","REACTOME_ELECTRIC_TRANSMISSION_ACROSS_GAP_JUNCTIONS",0.775641025641026,0.88411872653501,0.0605092988656667,-0.43886368972541,-0.732913960656845,3,"PANX1, PANX2"
"419","REACTOME_ELEVATION_OF_CYTOSOLIC_CA2_LEVELS",0.613924050632911,0.813161013815272,0.0573667426768556,0.402570703235719,0.91083348754385,14,"ITPR1, P2RX7, P2RX1, STIM1, P2RX4"
"420","REACTOME_ENDOGENOUS_STEROLS",0.708520179372197,0.853870971669284,0.0481183992657975,0.343591238905403,0.830812011738984,19,"CYP7B1, ARNT, CYP1B1, NCOA2, NCOA1, CYP27A1, ARNT2, CYP11A1, AHR, RXRA"
"421","REACTOME_ENDOSOMAL_SORTING_COMPLEX_REQUIRED_FOR_TRANSPORT_ESCRT",0.324749642346209,0.686681338749109,0.0843144320642653,0.418625719979867,1.10684623398451,31,"TSG101, HGS, CHMP3, CHMP7, UBA52, SNF8, CHMP4C, UBB, VPS4A, UBAP1, CHMP6, CHMP2A"
"422","REACTOME_ENDOSOMAL_VACUOLAR_PATHWAY",0.883374689826303,0.932421222730945,0.0614364107201271,-0.315897918206541,-0.701147575761538,9,"LNPEP, HLA-B, CTSL"
"423","REACTOME_ENERGY_DEPENDENT_REGULATION_OF_MTOR_BY_LKB1_AMPK",0.0378457059679767,0.289822603750417,0.282013350011725,0.574741476205425,1.48839308094822,28,"RRAGC, RHEB, SLC38A9, PRKAA1, PRKAB1, STRADB, STRADA, MTOR"
"424","REACTOME_ENHANCED_BINDING_OF_GP1BA_VARIANT_TO_VWF_MULTIMER_COLLAGEN",0.672284644194757,0.837822069147234,0.0610363728309177,0.556969410898657,0.869638483767366,3,"COL1A1, COL1A2"
"425","REACTOME_ENOS_ACTIVATION",0.608247422680412,0.811619927573556,0.0822054920415869,-0.388696046935525,-0.879778418048949,10,"CYGB, NOS3, HSP90AA1"
"426","REACTOME_EPHA_MEDIATED_GROWTH_CONE_COLLAPSE",0.240469208211144,0.615698357457939,0.103197466945307,0.458473408315836,1.17667865920942,27,"MYL9, MYL6, EPHA3, MYH11, LYN, EFNA5"
"427","REACTOME_EPHB_MEDIATED_FORWARD_SIGNALING",0.506944444444444,0.786806105905449,0.0602484086158019,0.349370349726313,0.968679226845947,40,"SDC2, ACTB, ARPC5, EPHB6, LYN, ACTG1, CDC42, KALRN"
"428","REACTOME_EPHRIN_SIGNALING",0.00500782224392511,0.108669742693175,0.407017918923954,-0.653717929559803,-1.769837403944,19,"EFNB2, FYN, NCK2, GIT1"
"429","REACTOME_EPH_EPHRIN_MEDIATED_REPULSION_OF_CELLS",0.453296703296703,0.77116997057027,0.0650877566917313,0.34924162366086,0.993136358655999,47,"ACTB, NCSTN, VAV3, EPHA3, CLTCL1, EPHB6, LYN, APH1B, ACTG1, EFNA5, PSEN1, PSEN2, AP2A2, CLTA, AP2A1, EPHA7, EPHA6, VAV2"
"430","REACTOME_EPH_EPHRIN_SIGNALING",0.200752823086575,0.575093895838768,0.104732821580651,0.37251486546288,1.17760231635408,86,"MYL9, SDC2, ACTB, MYL6, NCSTN, VAV3, EPHA3, MYH11, CLTCL1, ARPC5, EPHB6, LYN, APH1B, ACTG1, MYL12A, EFNA5, CDC42, KALRN, PSEN1, PSEN2, AP2A2, CLTA, SDCBP, AP2A1, WASL, EPHA7, EPHA6, VAV2"
"431","REACTOME_EPIGENETIC_REGULATION_OF_GENE_EXPRESSION",0.0308219178082192,0.260313474356589,0.276500599254472,0.386230430487688,1.31235592667678,181,"ACTB, SIRT1, SUZ12, ZCCHC8, CDK7, PIWIL4, SAP30L, BCL7B, HCFC1, ZNF708, UBE2I, TADA3, SMARCD3, POLR1C, GTF2H2, SMARCA5, MPHOSPH8, PHF19, UBTF, RBBP7, EP300, TASP1, JARID2, POLR2H, RRP8, MTREX, SMARCD1, ACTL6A, SMARCD2, BOD1, ZNF224, ZNF778, ZNF93, MTF2, GTF2H3, SMARCA4, SS18, ARID1A, ZNF649, ASH2L, DPF2, ATF7IP, SAP30, SAP30BP, SETD1B, PSIP1, KAT2B, HDAC1, POLR1B"
"432","REACTOME_EPITHELIAL_MESENCHYMAL_TRANSITION_EMT_DURING_GASTRULATION",0.24537037037037,0.616444230047703,0.132846300606183,-0.663760709867071,-1.25644819233492,5,"OCLN"
"433","REACTOME_ERBB2_ACTIVATES_PTK6_SIGNALING",0.804232804232804,0.896032622255823,0.069119845655101,-0.302631816864882,-0.739891938761669,13,"ERBB4, ERBB2"
"434","REACTOME_ERBB2_REGULATES_CELL_MOTILITY",0.925133689839572,0.959397900574371,0.0628003977812234,-0.24288015846282,-0.625805837516043,15,"ERBB4, ERBB2"
"435","REACTOME_ERCC6_CSB_AND_EHMT2_G9A_POSITIVELY_REGULATE_RRNA_EXPRESSION",0.986003110419907,0.989995025846708,0.0347156757446657,0.213567933814876,0.496140324854326,16,"RBBP7, HDAC1, RBBP4, CHD4, EHMT2, ERCC6"
"436","REACTOME_ERKS_ARE_INACTIVATED",0.192513368983957,0.565487662531556,0.16440575583821,-0.528943388222043,-1.24921239760344,12,"PPP2R1B, DUSP6, PPP2R5D"
"437","REACTOME_ERK_MAPK_TARGETS",0.00278292833175788,0.0766851362528839,0.431707695803346,-0.647835514098454,-1.79384269363681,21,"PPP2R1B, RPS6KA5, DUSP6, MAPK11, MEF2C, MAPK14, PPP2R5D, MEF2A"
"438","REACTOME_ERYTHROCYTES_TAKE_UP_CARBON_DIOXIDE_AND_RELEASE_OXYGEN",0.00244582103383876,0.069605660897444,0.431707695803346,-0.794314084993474,-1.7978582356035,10,"HBA2, HBA1, HBB, CA2"
"439","REACTOME_ERYTHROCYTES_TAKE_UP_OXYGEN_AND_RELEASE_CARBON_DIOXIDE",0.00126649602920895,0.0471841917826444,0.45505986738723,-0.879871181988822,-1.78493732133452,7,"HBA2, HBA1, HBB, CA2"
"440","REACTOME_ERYTHROPOIETIN_ACTIVATES_PHOSPHOINOSITIDE_3_KINASE_PI3K",0.0627009646302251,0.370234267340377,0.227987202850442,0.665863507431746,1.42873876878127,11,"JAK2, LYN, PIK3R1, PIK3R5, IRS2"
"441","REACTOME_ERYTHROPOIETIN_ACTIVATES_PHOSPHOLIPASE_C_GAMMA_PLCG",0.117241379310345,0.477772381414926,0.169570644405628,0.731667362331761,1.35063631429155,6,"JAK2, LYN, IRS2, PLCG2"
"442","REACTOME_ERYTHROPOIETIN_ACTIVATES_RAS",0.657051282051282,0.832438238453276,0.0547939500773363,0.394016712381068,0.875996646011788,13,"JAK2, GRB2, LYN, CRKL, IRS2"
"443","REACTOME_ERYTHROPOIETIN_ACTIVATES_STAT5",0.129310344827586,0.493368700265252,0.160801401070022,0.720923068446903,1.33080266550604,6,"JAK2, LYN, IRS2"
"444","REACTOME_ER_QUALITY_CONTROL_COMPARTMENT_ERQC",0.00357066923448349,0.0837659701495045,0.431707695803346,0.697580526420842,1.68676675910587,19,"RNF139, MAN1B1, RNF185, AMFR, OS9, UBA52, EDEM3, SEL1L, UGGT1, UBB, EDEM2, RPS27A"
"445","REACTOME_ER_TO_GOLGI_ANTEROGRADE_TRANSPORT",0.199764982373678,0.573209932893727,0.100990587455923,0.34652144294026,1.15248321265599,142,"TRAPPC3, TRAPPC1, RAB1B, SEC22A, GOLGB1, COPZ2, DCTN2, TRAPPC10, ARFGAP3, STX17, GOLGA2, COG7, LMAN2L, SEC22B, SEC24A, TRAPPC4, COPB1, TMED3, PPP6C, ARCN1, TUBB4A, TUBA4A, TMED10, DCTN5, COPZ1, ARF5, GORASP1, SEC24D, CNIH3, ARF1, USO1, TMED9, ARFGAP2, SEC13, TBC1D20, TUBB4B, TUBA1C, ACTR1A, DCTN4, TRAPPC9"
"446","REACTOME_ESR_MEDIATED_SIGNALING",0.072093023255814,0.390160183066362,0.178219874951973,0.376020343128711,1.2563897385958,148,"FKBP5, S1PR3, KAT5, GNG7, GTF2A1, GNG12, GTF2F1, SMC3, STAG1, KDM1A, CAV2, CREBBP, GNB2, RUNX1, PPP5C, CCNT1, AKT3, PIK3R1, RAD21, EP300, POLR2H, NCOA2, EBAG9, POLR2C, MAPK3, CDKN1B, YY1, POLR2I, MOV10, TNRC6A, CAV1, SRF, GNAI1, POLR2B, SP1, DDX5, KAT2B, HDAC1, FOS"
"447","REACTOME_ESTABLISHMENT_OF_SISTER_CHROMATID_COHESION",0.0944625407166124,0.432683299957887,0.184706471207739,0.657978519682537,1.37190494228145,10,"SMC3, STAG1, RAD21, PDS5B, PDS5A"
"448","REACTOME_ESTROGEN_BIOSYNTHESIS",0.767123287671233,0.881745062956708,0.0642140881844605,-0.422679874869656,-0.746748439699368,4,"HSD17B11, HSD17B14, HSD17B1, HSD17B2"
"449","REACTOME_ESTROGEN_DEPENDENT_GENE_EXPRESSION",0.227386934673367,0.607298028604561,0.0972150808846466,0.364478905581661,1.15032900040462,85,"KAT5, GTF2A1, GTF2F1, SMC3, STAG1, KDM1A, CREBBP, RUNX1, CCNT1, RAD21, EP300, POLR2H, NCOA2, EBAG9, POLR2C, YY1, POLR2I, MOV10, TNRC6A, POLR2B, SP1, DDX5, KAT2B, HDAC1, FOS"
"450","REACTOME_ESTROGEN_DEPENDENT_NUCLEAR_EVENTS_DOWNSTREAM_OF_ESR_MEMBRANE_SIGNALING",0.892011834319527,0.937368368267977,0.0370705393657621,0.277364143374662,0.694315197702196,23,"AKT3, MAPK3, CDKN1B, SRF, FOS, EGF, FOXO3, AREG, MAPK1"
"451","REACTOME_ESTROGEN_STIMULATED_SIGNALING_THROUGH_PRKCZ",0.277251184834123,0.640316819381892,0.12563992130984,-0.617151652814695,-1.2067001054518,6,"KRAS, HRAS, PRKCZ"
"452","REACTOME_ETHANOL_OXIDATION",0.0732899022801303,0.391480831871711,0.211400189384923,0.680490312968183,1.41884270627273,10,"ADH1B, ADH5, ALDH1A1, ALDH1B1, ACSS2"
"453","REACTOME_EUKARYOTIC_TRANSLATION_ELONGATION",4.41048437375227e-10,2.55220029094465e-07,0.814035837847908,0.667428823221048,2.11704679895559,92,"RPS13, RPS27L, RPL18, RPS24, RPL23, RPL10, RPL13A, FAU, RPL3, RPL7A, RPS15, RPS25, RPL14, RPL34, RPL41, RPL12, RPS11, RPS15A, UBA52, RPL19, RPL10A, RPS14, RPL7, RPS27, RPL23A, RPL37, RPS16, EEF1A1, RPLP1, RPS9, RPS4X, RPL30, RPL22, RPSA, RPS28, RPS6, RPL37A, RPL4, RPS26, RPL38, RPL22L1, RPL39, RPL18A, RPS12, RPS3A, RPS27A, EEF1A2, RPLP2, RPLP0, RPS17, RPS23, RPL32, RPL24"
"454","REACTOME_EUKARYOTIC_TRANSLATION_INITIATION",1.91268623743439e-11,3.3204233081861e-08,0.863415391606693,0.664437132043036,2.16175767607766,118,"RPS13, EIF4A1, RPS27L, RPL18, RPS24, RPL23, RPL10, RPL13A, FAU, EIF2S3, RPL3, RPL7A, RPS15, RPS25, EIF3L, RPL14, RPL34, RPL41, RPL12, RPS11, RPS15A, UBA52, RPL19, RPL10A, RPS14, RPL7, EIF2S1, RPS27, RPL23A, RPL37, EIF3B, RPS16, EIF3J, EIF2B1, EIF4A2, RPLP1, RPS9, RPS4X, RPL30, RPL22, EIF3I, RPSA, EIF3C, RPS28, EIF3K, EIF3F, RPS6, EIF4B, RPL37A, EIF4G1, PABPC1, RPL4, RPS26, RPL38, RPL22L1, RPL39, EIF4E, EIF3D, EIF5, RPL18A, RPS12, RPS3A, RPS27A, RPLP2, RPLP0, RPS17, RPS23, RPL32, RPL24"
"455","REACTOME_EVASION_BY_RSV_OF_HOST_INTERFERON_RESPONSES",0.0213564746258468,0.215238215094748,0.352487857583619,0.631829183818585,1.52777840598037,19,"IRF3, CREBBP, UBA52, RBX1, EP300, STAT2, JAK1, UBB, ELOB, RPS27A, TYK2, MAVS"
"456","REACTOME_EXPORT_OF_VIRAL_RIBONUCLEOPROTEINS_FROM_NUCLEUS",0.180257510729614,0.554328984581699,0.120433371642259,0.466906531866721,1.23450068104823,31,"NUP188, NUP54, POM121, NUP214, NUP107, NUP35, POM121C, NUP43, NUP133, SEC13"
"457","REACTOME_EXTENSION_OF_TELOMERES",0.670299727520436,0.837571365647755,0.0464154956843849,0.305335828074356,0.874650209422967,48,"RFC1, POLD4, ACD, PPP6C, RFC2, POLD3, DNA2, RUVBL1, CDK2, PRIM2, TEN1, POLA2, RPA2, RPA1, PCNA, CHTF8, RFC5, DSCC1"
"458","REACTOME_EXTRACELLULAR_MATRIX_ORGANIZATION",0.00130463203085653,0.0471841917826444,0.45505986738723,0.426083388519074,1.48903366190115,255,"COL6A2, SDC2, COL5A2, SCUBE3, COL14A1, TGFB2, CAST, FBN1, NCSTN, ITGB1, CAPN10, DCN, CRTAP, PLOD3, PPIB, COL1A1, TNC, MMP14, DMD, CAPN2, ADAMTS1, CTSB, SDC4, LTBP2, COL6A1, COMP, LAMA5, ITGAE, P4HB, PHYKPL, LAMC1, NTN4, SPARC, COL1A2, THBS1, LRP4, TRAPPC4, NID1, LAMA4, ADAM19, CD47, LTBP1, COL4A2, LAMB2, ITGA8, COLGALT2, LTBP3, COL16A1, TIMP1, CAPN5, ITGB5, MMP11, ITGA11, COL4A1, LOXL1, FBLN1, DAG1, CD151, KLKB1, COL8A1, CAPN7, PSEN1, LTBP4, FGF2, ADAMTS9, PTPRS, ACTN1, MATN3, BMP1"
"459","REACTOME_EXTRA_NUCLEAR_ESTROGEN_SIGNALING",0.838331160365059,0.906508830069994,0.0340463727579649,0.258295311557709,0.786216751199471,67,"S1PR3, GNG7, GNG12, CAV2, GNB2, AKT3, PIK3R1, MAPK3, CDKN1B, CAV1, SRF, GNAI1"
"460","REACTOME_EXTRINSIC_PATHWAY_OF_FIBRIN_CLOT_FORMATION",0.329059829059829,0.693261969960999,0.107140237276725,-0.693110878776473,-1.15751348592145,3,"F10"
"461","REACTOME_FACTORS_INVOLVED_IN_MEGAKARYOCYTE_DEVELOPMENT_AND_PLATELET_PRODUCTION",0.36284289276808,0.71988029925187,0.0713052987340038,0.322629753607164,1.04968147136328,118,"ACTB, AKAP1, PRKAR2B, PRKACA, KIF22, KIF26B, JAK2, AK3, RBSN, VPS45, KDM1A, DOCK10, EHD1, HMG20B, KIF23, CDC42, TUBB4A, KIF6, TUBA4A, MFN1, DOCK11, CDK2, KLC4, ABL1, DOCK5, KIF5B, PRKAR1A, HDAC1, RAB5A, TUBB4B, TUBA1C, DOCK7, KLC2, PRKAR2A, CARMIL1, CABLES2, DOCK8, GATA6, SH2B1, KIF19, MAFK, MICAL1"
"462","REACTOME_FANCONI_ANEMIA_PATHWAY",0.427762039660057,0.75063618642566,0.0694481442003175,0.378563208121711,1.02818353218789,35,"WDR48, UBA52, FANCC, UBB, USP1, FANCE, RPA2, MUS81, RPS27A, RPA1, SLX4, FANCF, CENPX, EME2"
"463","REACTOME_FASL_CD95L_SIGNALING",0.789954337899543,0.888319835545553,0.0628003977812234,-0.40983477624721,-0.724055006857186,4,"CASP10, FADD"
"464","REACTOME_FASTK_FAMILY_PROTEINS_REGULATE_PROCESSING_AND_STABILITY_OF_MITOCHONDRIAL_RNAS",0.848314606741573,0.911848958966602,0.0501934252649434,0.451526411681342,0.705002350850698,3,"FASTK, FASTKD2"
"465","REACTOME_FATTY_ACIDS",0.952782462057336,0.968401846681226,0.0400845633477088,0.282831278109257,0.544445477262449,7,"CYP2J2, CYP4F3, CYP4F11, CYP4F12"
"466","REACTOME_FATTY_ACIDS_BOUND_TO_GPR40_FFAR1_REGULATE_INSULIN_SECRETION",0.020301394737874,0.213140525533693,0.352487857583619,-0.784401860427879,-1.59126493089274,7,"PLCB1, GNA15, GNA14, PLCB2"
"467","REACTOME_FATTY_ACID_METABOLISM",0.745052386495926,0.871482172300528,0.0342688261591917,0.264448827772047,0.883165731228235,147,"SCP2, ACADVL, HACD1, LTA4H, ACOT2, OLAH, SLC27A3, ECI1, SCD, ACBD6, GGT5, MECR, HACD3, GPX4, ACBD4, ALDH3A2, CYP1B1, ACADL, ACAA2, ACOX3, SLC22A5, FADS1, CRAT, GGT1, CPT2, TBXAS1, CPT1A, HACL1, AKR1C3, PTGIS, ALOX5, CYP2J2, PRKAG2, MMAA, PTGDS"
"468","REACTOME_FATTY_ACYL_COA_BIOSYNTHESIS",0.425742574257426,0.75063618642566,0.118815039412263,-0.339124600804955,-1.02313658469079,31,"ACSL5, ELOVL7, CBR4, ELOVL5, HACD2, ELOVL1, ELOVL4"
"469","REACTOME_FBXW7_MUTANTS_AND_NOTCH1_IN_CANCER",0.729824561403509,0.867278212903422,0.0541200569620232,0.449055022697309,0.798014469183103,5,"RBX1, CUL1, SKP1, FBXW7"
"470","REACTOME_FCERI_MEDIATED_CA_2_MOBILIZATION",0.573313782991202,0.800174459522417,0.0570059526582387,0.358293832040652,0.91956632215007,27,"ITPR1, VAV3, GRB2, AHCYL1, LYN"
"471","REACTOME_FCERI_MEDIATED_MAPK_ACTIVATION",0.548991354466859,0.798708454553469,0.0582216241124161,0.359369854895636,0.944668919621222,30,"MAP2K7, VAV3, GRB2, LYN, MAPK3, PLCG2, VAV2, FOS, PAK2"
"472","REACTOME_FCERI_MEDIATED_NF_KB_ACTIVATION",0.401028277634961,0.735925042256124,0.0678338263479455,0.336186268907798,1.03652607423473,74,"IKBKG, MAP3K7, PSMD5, UBE2D2, PSMD8, PSMC2, PSMB7, LYN, UBA52, PSMB6, PSMD13, NFKB1, UBB, PSME1, PSMA4, FBXW11, PSMD12, TAB3, PSMB1, PSMD14, RPS27A, PSMD6, PSMF1, RELA, PSMB4, CUL1, PSMD11, SEM1, CHUK"
"473","REACTOME_FCGAMMA_RECEPTOR_FCGR_DEPENDENT_PHAGOCYTOSIS",0.125158027812895,0.486451966061491,0.138022242496643,0.39698397610098,1.24236559539155,81,"ACTB, ABI1, CYFIP2, ITPR1, VAV3, GRB2, PLPP5, AHCYL1, ARPC5, PLD3, LYN, PIK3R1, ACTG1, CDC42, NCKAP1, PRKCD, MAPK3, ABL1, PLD2, NCKIPSD, WASL, PLCG2, MYO9B, WASF3, FCGR2A, VAV2"
"474","REACTOME_FCGR3A_MEDIATED_IL10_SYNTHESIS",0.377464788732394,0.724570960186765,0.0755015292281669,0.395093667019726,1.0783627247622,36,"PRKAR2B, PRKACA, ITPR1, ADCY5, AHCYL1, ADCY6, LYN"
"475","REACTOME_FCGR_ACTIVATION",0.192513368983957,0.565487662531556,0.16440575583821,-0.53031385583658,-1.25244904858106,12,"FYN, FGR"
"476","REACTOME_FC_EPSILON_RECEPTOR_FCERI_SIGNALING",0.579656862745098,0.800174459522417,0.0482149710025564,0.289307515131999,0.947950482645666,121,"MAP2K7, ITPR1, IKBKG, MAP3K7, VAV3, PSMD5, UBE2D2, PSMD8, GRB2, PSMC2, AHCYL1, PSMB7, LYN, UBA52, PIK3R1, PSMB6, PSMD13, GAB2, NFKB1, MAPK3, UBB, PSME1, PSMA4, FBXW11, PLCG2, PSMD12, TAB3, PSMB1, VAV2, FOS, PAK2, PSMD14, RPS27A, PSMD6, PSMF1"
"477","REACTOME_FERTILIZATION",0.807894736842105,0.896569648898747,0.0686325631836726,-0.322894846308497,-0.734011114868239,11,"CATSPER2, B4GALT1"
"478","REACTOME_FGFR1B_LIGAND_BINDING_AND_ACTIVATION",0.391231028667791,0.733672641286847,0.083129129135339,0.569354645760906,1.09599816510798,7,"TGFBR3, FGF2"
"479","REACTOME_FGFR1C_LIGAND_BINDING_AND_ACTIVATION",0.0918196994991653,0.426200530295591,0.190023305279108,0.673442756802622,1.35986587400439,9,"TGFBR3, FGF2, FGF17"
"480","REACTOME_FGFR1_LIGAND_BINDING_AND_ACTIVATION",0.643312101910828,0.824199120972101,0.0554793308704233,0.39909637779867,0.874110200403784,12,"TGFBR3, FGF2, FGF17"
"481","REACTOME_FGFR1_MUTANT_RECEPTOR_ACTIVATION",0.0061757257954271,0.126130117421899,0.407017918923954,0.635998983722468,1.61533533986177,25,"CUX1, FGFR1OP2, GRB2, BAG4, PIK3R1, FGF2, GAB2, ERLIN2, FGF17, STAT1"
"482","REACTOME_FGFR2B_LIGAND_BINDING_AND_ACTIVATION",0.974619289340102,0.980265982789349,0.0578529757032509,-0.240933503011377,-0.509175537841829,8,"FGF10, FGFBP2, FGF22"
"483","REACTOME_FGFR2C_LIGAND_BINDING_AND_ACTIVATION",0.545232273838631,0.797332522114656,0.0852884689790502,-0.465688611978478,-0.944712135885609,7,"FGF18"
"484","REACTOME_FGFR2_ALTERNATIVE_SPLICING",0.596182085168869,0.803906422423306,0.0552495663125249,0.361863998966554,0.919076477659046,25,"TIAL1, GTF2F1, POLR2H, HNRNPH1, POLR2C, POLR2I, POLR2B, RBFOX2, POLR2G, NCBP1, POLR2D"
"485","REACTOME_FGFR2_LIGAND_BINDING_AND_ACTIVATION",0.582887700534759,0.800174459522417,0.0865399737444125,-0.377379426647757,-0.89126184175112,12,"FGF18, FGF10"
"486","REACTOME_FGFR2_MUTANT_RECEPTOR_ACTIVATION",0.82179675994109,0.8991253336152,0.0406579344155557,0.300665517303871,0.764439927294119,26,"GTF2F1, POLR2H, FGF2, POLR2C, POLR2I, FGF17, POLR2B, POLR2G, NCBP1, POLR2D"
"487","REACTOME_FGFR3B_LIGAND_BINDING_AND_ACTIVATION",0.231481481481481,0.610683953967536,0.137250779610133,-0.668109045915988,-1.2646792594757,5,"FGF18"
"488","REACTOME_FGFR3_LIGAND_BINDING_AND_ACTIVATION",0.49492385786802,0.786367558239862,0.0928481214159878,-0.455399008117074,-0.962415073007499,8,"FGF18"
"489","REACTOME_FGFRL1_MODULATION_OF_FGFR1_SIGNALING",0.106699751861042,0.458203490847169,0.216542836735348,-0.639463258591652,-1.41931328986145,9,"SPRED2, FGF18, FGF10, FGFRL1, SPRED1"
"490","REACTOME_FIBRONECTIN_MATRIX_FORMATION",0.159574468085106,0.533596385886659,0.14551614609036,0.768772828741077,1.28709086964409,4,"ITGB1, FN1, ITGA5"
"491","REACTOME_FICOLINS_BIND_TO_REPETITIVE_CARBOHYDRATE_STRUCTURES_ON_THE_TARGET_CELL_SURFACE",0.404494382022472,0.737438488230821,0.0870515867946735,0.687221321344393,1.07301064692633,3,"MASP2, MASP1"
"492","REACTOME_FLT3_SIGNALING",0.791095890410959,0.888319835545553,0.0833634065110386,-0.261722645496567,-0.810131728472519,36,"FYN, KRAS, SOS1, SH2B3, GRAP2, ABL2, GRB10, CSK"
"493","REACTOME_FLT3_SIGNALING_BY_CBL_MUTANTS",0.194827586206897,0.566533818517877,0.128142916898415,0.687739802363986,1.26954733759917,6,"UBA52, UBB, RPS27A, CBL, FLT3"
"494","REACTOME_FLT3_SIGNALING_IN_DISEASE",0.486803519061584,0.783577712609971,0.0647943366000727,0.384525021399506,0.98688905050116,27,"GOLGB1, GRB2, UBA52, PIK3R1, GAB2, UBB, NOX4, RPS27A"
"495","REACTOME_FLT3_SIGNALING_THROUGH_SRC_FAMILY_KINASES",0.0799086757990868,0.40326006159074,0.241339976815091,-0.816413628779823,-1.44235777402138,4,"FYN"
"496","REACTOME_FOLDING_OF_ACTIN_BY_CCT_TRIC",0.583061889250814,0.800174459522417,0.0611692626746689,0.451039646292906,0.940431186435485,10,"ACTB, CCT6B"
"497","REACTOME_FORMATION_OF_APOPTOSOME",0.100977198697068,0.445597749648383,0.178219874951973,0.648410599719807,1.35195554227587,10,"APAF1, CARD8, MAPK3, XIAP, CASP9, AVEN, UACA, MAPK1, APIP"
"498","REACTOME_FORMATION_OF_ATP_BY_CHEMIOSMOTIC_COUPLING",0.0153657847990732,0.196139723611699,0.380730400722792,0.705691465000674,1.60524620496842,15,"ATP5MC2, ATP5MC3, ATP5ME, ATP5MG, ATP5PF, ATP5MC1, ATP5F1A, ATP5PD, ATP5PB, ATP5F1E, ATP5F1B"
"499","REACTOME_FORMATION_OF_AXIAL_MESODERM",0.524671052631579,0.794721014520245,0.0667426134241917,0.484229185857088,0.968771558930043,8,"TEAD2, SMAD2, YAP1"
"500","REACTOME_FORMATION_OF_DEFINITIVE_ENDODERM",0.556701030927835,0.799296062863223,0.0870515867946735,-0.406365574594038,-0.919771799030406,10,"SOX17, CTNNB1"
"501","REACTOME_FORMATION_OF_FIBRIN_CLOT_CLOTTING_CASCADE",0.251497005988024,0.622822827953223,0.151148761385484,-0.42460959162285,-1.18388483559769,22,"VWF, PROCR, C1QBP, SERPINE2, F10"
"502","REACTOME_FORMATION_OF_INCISION_COMPLEX_IN_GG_NER",0.272222222222222,0.635636977460034,0.0925528864684773,0.410264692130049,1.14776277865833,42,"CDK7, UBE2I, GTF2H2, PIAS3, UBA52, RBX1, DDB2, XPA, RAD23A, GTF2H3, UBB, XPC, RPA2, RNF111, RPS27A, RPA1, CUL4A"
"503","REACTOME_FORMATION_OF_INTERMEDIATE_MESODERM",0.39460370994941,0.733672641286847,0.0826646449123753,0.56743216209501,1.09229741622332,7,"FOXC1, FGF2, FOXC2"
"504","REACTOME_FORMATION_OF_LATERAL_PLATE_MESODERM",0.265135699373695,0.627078438845688,0.119887845115423,-0.790532791158378,-1.19662823894806,2,"FOXF1, BMP4"
"505","REACTOME_FORMATION_OF_PARAXIAL_MESODERM",0.692715231788079,0.847074959118004,0.0436251240000606,0.288779710092533,0.865227573477855,60,"MAML1, PSMD5, PSMD8, PSMC2, CREBBP, MAML3, PSMB7, PSMB6, EP300, PSMD13, MAML2, PSME1, PSMA4, PSMD12, SNW1, PSMB1, KAT2B, PSMD14, PSMD6, PSMF1"
"506","REACTOME_FORMATION_OF_RNA_POL_II_ELONGATION_COMPLEX",0.258021390374332,0.623385565052232,0.0934449219410994,0.388741208231777,1.14803332159731,56,"CDK7, NELFCD, GTF2F1, NELFB, GTF2H2, CCNT1, PAF1, ELOA, POLR2H, RTF1, SUPT4H1, POLR2C, GTF2H3, POLR2I, SUPT6H, ELOB, POLR2B, SSRP1, ELL, NELFA, EAF2, CTDP1, CCNH, POLR2G"
"507","REACTOME_FORMATION_OF_SENESCENCE_ASSOCIATED_HETEROCHROMATIN_FOCI_SAHF",0.745980707395498,0.871482172300528,0.0490939668192139,0.374988329923305,0.804609892000858,11,"CABIN1, ASF1A, UBN1, HMGA1"
"508","REACTOME_FORMATION_OF_TC_NER_PRE_INCISION_COMPLEX",0.0143306295475318,0.187067497995277,0.380730400722792,0.526361324207425,1.51450121153244,49,"CDK7, COPS6, GTF2H2, UBA52, RBX1, USP7, COPS2, POLR2H, ERCC8, POLR2C, XPA, GTF2H3, UBB, POLR2I, COPS3, POLR2B, COPS4, ZNF830, RPS27A, CUL4A, GPS1, CCNH, POLR2G, COPS8"
"509","REACTOME_FORMATION_OF_THE_ANTERIOR_NEURAL_PLATE",0.991652754590985,0.993369406791662,0.037770500132479,0.216844850065189,0.437869304523049,9,"ZNF521, SOX2, PAX6, POU5F1, NANOG, ZEB2, ZIC2, OTX2, POU3F1"
"510","REACTOME_FORMATION_OF_THE_BETA_CATENIN_TCF_TRANSACTIVATING_COMPLEX",0.798270893371758,0.893118971061093,0.0409883873374721,0.297030106816626,0.780797571857898,30,"KAT5, CREBBP, EP300, RUVBL1, SMARCA4, ASH2L, HDAC1, TLE1, PYGO2"
"511","REACTOME_FORMATION_OF_THE_CORNIFIED_ENVELOPE",0.948680351906158,0.966495945369185,0.0337507376805299,0.244982155906118,0.628750260131255,27,"KRT10, KRT17, PERP, KRT18, CAPNS1, FURIN, JUP"
"512","REACTOME_FORMATION_OF_THE_EARLY_ELONGATION_COMPLEX",0.0409604519774011,0.30664205757084,0.266350657088526,0.548946247239231,1.46588081037753,32,"CDK7, NELFCD, GTF2F1, NELFB, GTF2H2, POLR2H, SUPT4H1, POLR2C, GTF2H3, POLR2I, POLR2B, NELFA, CTDP1, CCNH, POLR2G, NCBP1, POLR2D, ERCC3"
"513","REACTOME_FORMATION_OF_THE_NEPHRIC_DUCT",0.114973262032086,0.472970575563271,0.216542836735348,-0.53380452889324,-1.37540255403378,15,"MECOM, PCDH19"
"514","REACTOME_FORMATION_OF_THE_POSTERIOR_NEURAL_PLATE",0.864928909952607,0.921175820661181,0.0602484086158019,-0.339351759576046,-0.663525410971594,6,"TBX6, POU3F1, OTX2"
"515","REACTOME_FORMATION_OF_THE_URETERIC_BUD",0.0422960725075529,0.309814269506801,0.271288554688953,0.614427360319913,1.46890829731626,18,"SLIT2, ITGB1, FOXC1, ITGA8, NPNT, SALL1, EYA1"
"516","REACTOME_FORMATION_OF_TUBULIN_FOLDING_INTERMEDIATES_BY_CCT_TRIC",0.471641791044776,0.776417293289816,0.105520936843198,-0.3563588139297,-0.973963185058485,20,"CCT3, TCP1, TUBB2B, TUBA1B"
"517","REACTOME_FORMATION_OF_WDR5_CONTAINING_HISTONE_MODIFYING_COMPLEXES",0.827777777777778,0.8991253336152,0.0376142599562161,0.279169872026054,0.77403836932563,40,"HCFC1, TADA3, TASP1, BOD1, ASH2L, SETD1B, PSIP1, KAT2B, KMT2A, PHF20, BOD1L1, SGF29, WDR5"
"518","REACTOME_FORMATION_OF_XYLULOSE_5_PHOSPHATE",0.110526315789474,0.464891041162228,0.176694268938498,0.753092232465977,1.33831817430166,5,"DCXR, AKR1A1"
"519","REACTOME_FORMYL_PEPTIDE_RECEPTORS_BIND_FORMYL_PEPTIDES_AND_MANY_OTHER_LIGANDS",0.105022831050228,0.455018609632076,0.208955027549354,-0.794360861715138,-1.40339715541685,4,"APP, HEBP1"
"520","REACTOME_FOXO_MEDIATED_TRANSCRIPTION",0.00753223276506595,0.142129957392984,0.407017918923954,0.51422556026441,1.53420863265389,58,"BCL6, SIRT1, PPARGC1A, BTG1, DDIT3, NFYB, BBC3, CREBBP, FBXO32, AKT3, SREBF1, EP300, ABCA6, CCNG2, TXNIP, KLF4, CDKN1B, SMAD2, RBL2, CAV1, KAT2B, HDAC1, YWHAQ, SOD2, BCL2L11"
"521","REACTOME_FOXO_MEDIATED_TRANSCRIPTION_OF_CELL_CYCLE_GENES",0.188180404354588,0.565487662531556,0.123257226381337,0.534893827193592,1.24261349747589,16,"BTG1, CCNG2, KLF4, CDKN1B, SMAD2, RBL2, CAV1"
"522","REACTOME_FOXO_MEDIATED_TRANSCRIPTION_OF_CELL_DEATH_GENES",0.0684713375796178,0.384680394945685,0.216542836735348,0.625120459999676,1.42197021762427,15,"BCL6, DDIT3, NFYB, BBC3, CREBBP, EP300"
"523","REACTOME_FOXO_MEDIATED_TRANSCRIPTION_OF_OXIDATIVE_STRESS_METABOLIC_AND_NEURONAL_GENES",0.436123348017621,0.75635377838021,0.0702812841717392,0.399939018062317,1.01578091506446,25,"PPARGC1A, FBXO32, SREBF1, ABCA6, SMAD2, HDAC1, SOD2"
"524","REACTOME_FREE_FATTY_ACIDS_REGULATE_INSULIN_SECRETION",0.0721649484536082,0.390160183066362,0.271288554688953,-0.648163340216802,-1.46705921654987,10,"PLCB1, GNA15, GNA14, PLCB2"
"525","REACTOME_FREE_FATTY_ACID_RECEPTORS",0.839147286821705,0.906508830069994,0.0522693317499306,-0.576760673513006,-0.777045124028073,1,"FFAR3"
"526","REACTOME_FRS_MEDIATED_FGFR1_SIGNALING",0.680911680911681,0.842801675874616,0.0815265143256594,-0.307182435834407,-0.820685493902414,17,"KRAS, KL, SOS1, FGF10"
"527","REACTOME_FRS_MEDIATED_FGFR2_SIGNALING",0.576470588235294,0.800174459522417,0.0925528864684773,-0.340297883158854,-0.919916004264908,18,"FGF18, KRAS, SOS1, FGF10"
"528","REACTOME_FRS_MEDIATED_FGFR3_SIGNALING",0.601604278074866,0.808709063196791,0.0847985102819124,-0.351304731238507,-0.905172958332523,15,"FGF18, KRAS, SOS1"
