"","pathway","pval","padj","log2err","ES","NES","size","leadingEdge"
"1","REACTOME_2_LTR_CIRCLE_FORMATION",0.193929173693086,0.566533818517877,0.126875729929857,0.659447913670712,1.26942619815013,7,"BANF1, XRCC4, PSIP1, HMGA1, XRCC5"
"2","REACTOME_ABACAVIR_ADME",0.0282887421615409,0.24896207347667,0.352487857583619,-0.742909535089155,-1.5700239168439,8,"ABCB1, ABCG2"
"3","REACTOME_ABACAVIR_TRANSMEMBRANE_TRANSPORT",0.000254851867572363,0.0158008157894865,0.49849310876659,-0.944517632519319,-1.78789954627628,5,"ABCB1, ABCG2"
"4","REACTOME_ABC_FAMILY_PROTEINS_MEDIATED_TRANSPORT",0.190062111801242,0.565487662531556,0.107554375265169,0.365456345229539,1.16886919134617,96,"ABCA5, PSMD5, EIF2S3, ABCB7, ABCA7, PSMD8, PSMC2, RNF185, PSMB7, OS9, UBA52, EIF2S1, SEL1L, PSMB6, PSMD13, ABCA6, ABCF1, ABCA9, ABCB10, ERLIN2, ABCB8, UBB, PSME1, PSMA4"
"5","REACTOME_ABC_TRANSPORTERS_IN_LIPID_HOMEOSTASIS",0.225505443234837,0.607298028604561,0.11101149245045,0.520171201184627,1.20841131964741,16,"ABCA5, ABCA7, ABCA6, ABCA9"
"6","REACTOME_ABC_TRANSPORTER_DISORDERS",0.509090909090909,0.786806105905449,0.0568864160475701,0.318138803979058,0.978232286871464,72,"PSMD5, PSMD8, PSMC2, RNF185, PSMB7, OS9, UBA52, LMBRD1, SEL1L, PSMB6, PSMD13, ERLIN2, UBB, PSME1, PSMA4, PSMD12, PSMB1, PSMD14, RPS27A, PSMD6, PSMF1, ABCA1, PSMB4, PSMD11"
"7","REACTOME_ABERRANT_REGULATION_OF_MITOTIC_EXIT_IN_CANCER_DUE_TO_RB1_DEFECTS",0.449925261584454,0.770286246657409,0.0696133438850965,0.416402056797926,1.00687034862313,19,"UBE2E1, ANAPC4, ANAPC1, CDC26, ANAPC7, ANAPC5, ANAPC16, ANAPC11"
"8","REACTOME_ABERRANT_REGULATION_OF_MITOTIC_G1_S_TRANSITION_IN_CANCER_DUE_TO_RB1_DEFECTS",0.524105754276827,0.794641879273789,0.0640703750499722,0.417644589470589,0.970231432183084,16,"CDKN1C, CDK6, CDK2, CDKN1B, TFDP2"
"9","REACTOME_ABORTIVE_ELONGATION_OF_HIV_1_TRANSCRIPT_IN_THE_ABSENCE_OF_TAT",0.0857988165680473,0.418134132633945,0.184706471207739,0.543763984215466,1.36118387045405,23,"NELFCD, GTF2F1, NELFB, POLR2H, SUPT4H1, POLR2C, POLR2I, POLR2B, NELFA, CTDP1, POLR2G, NCBP1, POLR2D"
"10","REACTOME_ACETYLCHOLINE_BINDING_AND_DOWNSTREAM_EVENTS",0.312796208530806,0.677075084799849,0.117249716749792,-0.59162762740555,-1.15679366185354,6,"CHRNA5, CHRNB4, CHRNA4"
"11","REACTOME_ACETYLCHOLINE_INHIBITS_CONTRACTION_OF_OUTER_HAIR_CELLS",0.0599250936329588,0.365291038691181,0.252961123069611,0.877587565252058,1.37024386741009,3,"KCNMB1, KCNMA1"
"12","REACTOME_ACETYLCHOLINE_NEUROTRANSMITTER_RELEASE_CYCLE",0.0756756756756757,0.396897199314118,0.271288554688953,-0.588562795555921,-1.48892563227412,14,"SNAP25, PPFIA3, TSPOAP1, STX1A"
"13","REACTOME_ACETYLCHOLINE_REGULATES_INSULIN_SECRETION",0.0310396827141785,0.260313474356589,0.352487857583619,-0.691681917742987,-1.56555958873934,10,"PLCB1, GNA15, GNA14, PLCB2"
"14","REACTOME_ACROSOME_REACTION_AND_SPERM_OOCYTE_MEMBRANE_BINDING",0.425093632958801,0.75063618642566,0.0843144320642653,0.681076894393257,1.06341688821562,3,"IZUMO4, CD9"
"15","REACTOME_ACTIVATED_NOTCH1_TRANSMITS_SIGNAL_TO_THE_NUCLEUS",0.542483660130719,0.794727117288547,0.102449405629826,-0.319701246190511,-0.943177141908179,29,"DLL4, ARRB2, APH1A, JAG2, DLL1, MIB1, NEURL1B"
"16","REACTOME_ACTIVATED_NTRK2_SIGNALS_THROUGH_CDK5",0.26303317535545,0.626894417058351,0.129442887745046,-0.623571689304769,-1.21925303093494,6,"TIAM1, BDNF"
"17","REACTOME_ACTIVATED_NTRK2_SIGNALS_THROUGH_FRS2_AND_FRS3",0.767100977198697,0.881745062956708,0.0484087618816951,0.371131979672011,0.773821305589715,10,"GRB2, FRS3"
"18","REACTOME_ACTIVATED_NTRK2_SIGNALS_THROUGH_FYN",0.0166525577373787,0.205027235688577,0.352487857583619,-0.796393153188835,-1.6155908849849,7,"FYN, DOCK3, GRIN2B, BDNF"
"19","REACTOME_ACTIVATED_NTRK2_SIGNALS_THROUGH_PI3K",0.424137931034483,0.75063618642566,0.0799858801499946,0.579394439096705,1.06954500095326,6,"GRB2, PIK3R1, NTRK2"
"20","REACTOME_ACTIVATED_NTRK2_SIGNALS_THROUGH_RAS",0.530456852791878,0.794721014520245,0.0888945288620449,-0.442738516018074,-0.935659089330352,8,"KRAS, SOS1, BDNF, HRAS"
"21","REACTOME_ACTIVATED_NTRK3_SIGNALS_THROUGH_PI3K",0.0431034482758621,0.313086134756889,0.287857117255149,0.796968763612872,1.47118076998971,6,"NTF3, NTRK3, PIK3R1"
"22","REACTOME_ACTIVATED_NTRK3_SIGNALS_THROUGH_RAS",0.427631578947368,0.75063618642566,0.0770736734944102,0.537090796874698,1.07452897052109,8,"GRB2, NTF3, NTRK3"
"23","REACTOME_ACTIVATED_PKN1_STIMULATES_TRANSCRIPTION_OF_AR_ANDROGEN_RECEPTOR_REGULATED_GENES_KLK2_AND_KLK3",0.221052631578947,0.603006189213086,0.120433371642259,0.692502240765351,1.23064386353602,5,"KDM1A, NCOA2"
"24","REACTOME_ACTIVATED_TAK1_MEDIATES_P38_MAPK_ACTIVATION",0.360778443113772,0.71808578337788,0.0810802057550866,0.439903725818303,1.08874984676079,22,"IKBKG, MAP3K7, UBA52, MAP2K6, UBB, TAB3, IRAK2, RPS27A"
"25","REACTOME_ACTIVATION_OF_AMPK_DOWNSTREAM_OF_NMDARS",0.889561270801815,0.93535939800845,0.0382416816260774,0.288889359499273,0.70992869349882,21,"PRKAA1, PRKAB1, TUBB4A, TUBA4A, PRKAG2, TUBB4B, TUBA1C"
"26","REACTOME_ACTIVATION_OF_ANTERIOR_HOX_GENES_IN_HINDBRAIN_DEVELOPMENT_DURING_EARLY_EMBRYOGENESIS",0.0665760869565217,0.37936750092772,0.20207170902116,0.478070410748562,1.37555360353791,49,"SUZ12, CREBBP, PBX1, RBBP7, EP300, POLR2H, RARB, ZNF335, CTCF, POLR2C, NCOR1, YY1, POLR2I, ASH2L, CNOT6, MEIS1, PKNOX1, POLR2B, RARA, RBBP4"
"27","REACTOME_ACTIVATION_OF_ATR_IN_RESPONSE_TO_REPLICATION_STRESS",0.417021276595745,0.748654535853374,0.0707899094502623,0.384511155977358,1.03286518584436,33,"ORC2, RAD9A, CHEK1, RFC2, CDK2, MCM5, RAD1, RPA2, RPA1"
"28","REACTOME_ACTIVATION_OF_BAD_AND_TRANSLOCATION_TO_MITOCHONDRIA",0.166666666666667,0.542182315049776,0.134273452883202,0.574814921063822,1.27795580011452,13,"PPP3CC, BAD, AKT3, YWHAH, YWHAQ"
"29","REACTOME_ACTIVATION_OF_BH3_ONLY_PROTEINS",0.12372634643377,0.486451966061491,0.150169802128406,0.510470045315595,1.32195102482476,28,"TP63, BBC3, PPP3CC, BAD, TP53BP2, AKT3, YWHAH, TFDP2, YWHAQ, BCL2L11"
"30","REACTOME_ACTIVATION_OF_C3_AND_C5",0.24283305227656,0.615698357457939,0.11146266692298,0.643190259226704,1.23813048541246,7,"C3, C2, C5, CFB"
"31","REACTOME_ACTIVATION_OF_CASPASES_THROUGH_APOPTOSOME_MEDIATED_CLEAVAGE",0.789655172413793,0.888319835545553,0.0496901392724606,0.403461780863584,0.74477851646471,6,"APAF1, XIAP, CASP9"
"32","REACTOME_ACTIVATION_OF_GENE_EXPRESSION_BY_SREBF_SREBP",0.132311977715877,0.500421771927589,0.141225119642531,0.464025174947711,1.29358813934661,41,"NFYB, SCD, CREBBP, SMARCD3, FDFT1, SREBF1, DHCR7, NCOA2, SQLE, CHD9, SP1, MTF1, NCOA1, LSS, ACACA, TGS1, TBL1XR1, PPARA, GPAM, SC5D, HMGCR, RXRA, CARM1"
"33","REACTOME_ACTIVATION_OF_IRF3_IRF7_MEDIATED_BY_TBK1_IKK_IKBKE",0.265940902021773,0.627273649333964,0.100633389423036,0.504869551233903,1.17286400951639,16,"IRF3, OPTN, UBA52, TANK, UBB, TICAM1, RPS27A, SARM1"
"34","REACTOME_ACTIVATION_OF_KAINATE_RECEPTORS_UPON_GLUTAMATE_BINDING",0.496360989810771,0.786367558239862,0.0635007968065945,0.375518747202552,0.972471151364846,28,"GNG7, GNG12, GRIK1, GNB2, GRIK5, DLG3"
"35","REACTOME_ACTIVATION_OF_MATRIX_METALLOPROTEINASES",0.502673796791444,0.786806105905449,0.0949751525905595,-0.383221882108211,-0.98741079718093,15,"MMP16, SPOCK3, MMP2"
"36","REACTOME_ACTIVATION_OF_NIMA_KINASES_NEK9_NEK6_NEK7",0.670175438596491,0.837571365647755,0.0580983576873206,0.485188359635859,0.862226924760663,5,"NEK9, PLK1, NEK7, CCNB2"
"37","REACTOME_ACTIVATION_OF_NMDA_RECEPTORS_AND_POSTSYNAPTIC_EVENTS",0.0405655027633592,0.306181359987789,0.321775918075361,-0.359741114824563,-1.29922129305867,84,"RASGRF2, GIT1, PRKAA2, GRIA4, KRAS, TUBB2B, GRIA2, CAMK2A, GRIN1, ADCY1, GRIA3, GRIN2B, TUBA1B, ERBB4, RASGRF1, KIF17, DLG4, APBA1, CAMK2D, GRIN2A, PRKAR1B"
"38","REACTOME_ACTIVATION_OF_NOXA_AND_TRANSLOCATION_TO_MITOCHONDRIA",0.826315789473684,0.8991253336152,0.0484087618816951,0.401178477942653,0.712933190681379,5,"TFDP2, PMAIP1, TFDP1, E2F1"
"39","REACTOME_ACTIVATION_OF_PPARGC1A_PGC_1ALPHA_BY_PHOSPHORYLATION",0.531017369727047,0.794721014520245,0.0875697115548511,-0.419075842271932,-0.930154945424725,9,"PRKAA2, MAPK11, MAPK14, MAPK12"
"40","REACTOME_ACTIVATION_OF_PUMA_AND_TRANSLOCATION_TO_MITOCHONDRIA",0.240400667779633,0.615698357457939,0.11146266692298,0.602149740243015,1.21590569432329,9,"TP63, BBC3, TP53BP2, TFDP2"
"41","REACTOME_ACTIVATION_OF_RAC1",0.451923076923077,0.77116997057027,0.0728938564822936,0.461366986103177,1.02573296945861,13,"SLIT2, ROBO1, PAK2"
"42","REACTOME_ACTIVATION_OF_RAC1_DOWNSTREAM_OF_NMDARS",0.466992665036675,0.774349651740974,0.0940503465727813,-0.500964333999736,-1.01627369405648,7,"GIT1"
"43","REACTOME_ACTIVATION_OF_RAS_IN_B_CELLS",0.0648148148148148,0.373815676141257,0.271288554688953,-0.77413831905831,-1.46538455370882,5,"KRAS, RASGRP3, HRAS"
"44","REACTOME_ACTIVATION_OF_SMO",0.665738161559889,0.837479310484034,0.0815265143256594,-0.327794119338124,-0.852097377883993,16,"ARRB2, DHH, EFCAB7, SMO, GRK2"
"45","REACTOME_ACTIVATION_OF_THE_AP_1_FAMILY_OF_TRANSCRIPTION_FACTORS",0.731958762886598,0.867867546410912,0.0725351864394589,-0.349978435231412,-0.792144598656575,10,"MAPK11, MAPK14, MAPK10, JUN"
"46","REACTOME_ACTIVATION_OF_THE_MRNA_UPON_BINDING_OF_THE_CAP_BINDING_COMPLEX_AND_EIFS_AND_SUBSEQUENT_BINDING_TO_43S",2.11541835831147e-07,2.82489713079132e-05,0.690132458796796,0.679446828327086,2.03235413948468,59,"RPS13, EIF4A1, RPS27L, RPS24, FAU, EIF2S3, RPS15, RPS25, EIF3L, RPS11, RPS15A, RPS14, EIF2S1, RPS27, EIF3B, RPS16, EIF3J, EIF4A2, RPS9, RPS4X, EIF3I, RPSA, EIF3C, RPS28, EIF3K, EIF3F, RPS6, EIF4B, EIF4G1, PABPC1, RPS26, EIF4E, EIF3D, RPS12, RPS3A, RPS27A, RPS17, RPS23"
"47","REACTOME_ACTIVATION_OF_THE_PHOTOTRANSDUCTION_CASCADE",0.917061611374408,0.954589194886129,0.0574877409561325,-0.300854049128578,-0.58825186832654,6,"GNB1, CNGA1, PDE6A, PDE6B"
"48","REACTOME_ACTIVATION_OF_THE_PRE_REPLICATIVE_COMPLEX",0.880747126436782,0.931346729680003,0.0363018462359236,0.274243172255741,0.715915325306798,29,"ORC2, CDK2, PRIM2, MCM5, POLA2, RPA2, RPA1"
"49","REACTOME_ACTIVATION_OF_THE_TFAP2_AP_2_FAMILY_OF_TRANSCRIPTION_FACTORS",0.228618421052632,0.609065393154874,0.11378726182188,0.626235281898028,1.25287559697073,8,"CREBBP, CITED4, EP300, WWOX"
"50","REACTOME_ACTIVATION_OF_TRKA_RECEPTORS",0.504739336492891,0.786806105905449,0.0878312634480124,-0.500626624428229,-0.978861836850515,6,"ADCYAP1R1, NTRK1, ADCYAP1, ADORA2A"
"51","REACTOME_ACYL_CHAIN_REMODELING_OF_CL",0.907407407407407,0.948380047717796,0.0568864160475701,-0.321054903120506,-0.60773234490907,5,"PLA2G6"
"52","REACTOME_ACYL_CHAIN_REMODELING_OF_DAG_AND_TAG",0.24822695035461,0.619641437143064,0.11331290842208,0.713250965060001,1.19413534216198,4,"PNPLA2, DGAT1"
"53","REACTOME_ACYL_CHAIN_REMODELLING_OF_PC",0.761146496815287,0.879141928457311,0.0477342401407188,0.355604660077214,0.80889887347226,15,"PLB1, PNPLA8, PLA2R1, LPCAT2"
"54","REACTOME_ACYL_CHAIN_REMODELLING_OF_PE",0.661375661375661,0.833804029156244,0.0791316651768349,-0.344901350590765,-0.843234963242661,13,"PLA2G12A, PLA2G4C, PLA2G6, LPCAT3"
"55","REACTOME_ACYL_CHAIN_REMODELLING_OF_PG",0.880710659898477,0.931346729680003,0.0626618230932491,-0.317669145487012,-0.671344399958631,8,"PLA2G12A"
"56","REACTOME_ACYL_CHAIN_REMODELLING_OF_PI",0.503667481662592,0.786806105905449,0.0897104652742981,-0.485968283360094,-0.98585218349079,7,"PLA2G12A, PLA2G4C"
"57","REACTOME_ACYL_CHAIN_REMODELLING_OF_PS",0.192105263157895,0.565487662531556,0.163180127180689,-0.546605310029556,-1.24255427918589,11,"PLA1A, PLA2G12A, OSBPL8"
"58","REACTOME_ADAPTIVE_IMMUNE_SYSTEM",0.208924949290061,0.587834217127303,0.0897104652742981,0.299175467832276,1.08755722454931,633,"ZBTB16, TRAF7, ITGB1, FBXO17, PRKACA, KIF22, BTN2A1, FBXL12, DZIP3, ITPR1, FBXW5, IKBKG, DCTN2, MAP3K7, CTSO, UBE2E1, COL1A1, PSMD5, TIRAP, LRSAM1, HECW2, LTN1, HECTD1, KLHL42, ANAPC4, SMURF1, UBE2D2, CUL3, GLMN, TLR2, STX4, CTSB, PSMD8, GRB2, SEC22B, HECTD2, PSMC2, ERAP1, AHCYL1, SEC61G, HECTD3, KLHL20, C3, UFL1, UBR1, COL1A2, SEC24A, FBXO32, ASB13, ANAPC13, CUL7, CYBA, PSMB7, RAB7A, LYN, UBA52, CLEC2D, PRKN, AKT3, UBE2J2, SNAP23, RCHY1, HLA-F, PIK3R1, HLA-A, RBX1, HMGB1, CD81, PSMB6, VASP, ANAPC1, ARIH2, PPP2R5A, PSMD13, FBXL3, KIF23, RNF41, UBE2L3, KEAP1, RNF130, MTOR, CDC42, CDC26, ITGB5, KLHL2, TUBB4A, KLHL3, TRIM69, ATG7, AP1G1, AP1M1, LONRF1, HERC5, ANAPC7, KLHL9, NPEPPS, TUBA4A, UBR4, ANAPC5, LGMN, MYLIP, RLIM, FBXL19, TAPBP, DCTN5, BTBD6, KLC4, SEC61B, VHL, AP1S3, NFKB1, RAP1A, UBE2M, CALR, UBE2E2, FBXL22, UBB, UBE2R2, SEC24D, TNFRSF14, PSME1, AP2A2, TRIM21, PSMA4, CLTA, ELOB, PPP2R5E, STIM1, AP2A1, FBXW11, ARF1, UBE2K, LAIR1, PLCG2, RBBP6, HERC4, PSMD12, RNF217, MGRN1, HLA-C, KIF5B, NFKBIB, RNF114, RAF1, KLRD1, PRKG1, CDH1, ANAPC11, PSMB1, FBXO31, RNF111, SEC13, CBLB, KLHL22, PIK3R4, FBXL4, RNF123, PIK3AP1, UBA1, PAK2, PSMD14, TUBB4B, SMURF2, ASB3, RPS27A, TUBA1C, COL3A1, ASB8, KLC2, SOCS3, B2M, PVR, PSMD6, ERAP2, ACTR1A, TRIM32, DCTN4, WSB1, PSMF1"
"59","REACTOME_ADENYLATE_CYCLASE_ACTIVATING_PATHWAY",0.671009771986971,0.837571365647755,0.0545680646670941,0.414996656616507,0.865280472251824,10,"ADCY5, ADCY6, GNAL, ADCY8"
"60","REACTOME_ADENYLATE_CYCLASE_INHIBITORY_PATHWAY",0.69047619047619,0.847049974948856,0.0768736734126542,-0.336637658942954,-0.823031407324558,13,"GNAI2, ADCY4, ADCY1"
"61","REACTOME_ADHERENS_JUNCTIONS_INTERACTIONS",0.182481751824818,0.559145433849926,0.199915231309662,-0.349655863620282,-1.18374681967883,53,"AFDN, CADM2, CDH18, CADM1, CDH5, CDH2, FOXF1, AGO3, CDH7, CDH11, CTNNB1, AGO4, ZC3H12A, CDH6, SNAI1, TNRC6B, AGO1"
"62","REACTOME_ADIPOGENESIS",0.018981395479734,0.213140525533693,0.352487857583619,0.445674433023459,1.42757058807358,102,"ADIRF, CEBPD, PPARGC1A, NR2F2, EBF1, CDK19, MED14, MED30, CREBBP, SMARCD3, THRAP3, MED28, ZNF423, SREBF1, RBBP7, EP300, MED29, PPARG, MED13L, NCOA2, NCOR1, KLF4, ZNF638, CHD9, NFKB1, MED21, HNRNPU, MED17, MED19, MED13, ANGPTL4, HDAC1, PRDM16, MED16, NCOA1, RBBP4, PLIN1, TGS1, TBL1XR1, SMAD1, COX7A1, RELA, PPARA"
"63","REACTOME_ADORA2B_MEDIATED_ANTI_INFLAMMATORY_CYTOKINES_PRODUCTION",0.238826815642458,0.614785303231518,0.100633389423036,0.425150144624451,1.17376977584872,39,"PRKAR2B, PRKACA, ADCY5, GNG7, GNG12, GNB2, ADCY6"
"64","REACTOME_ADP_SIGNALLING_THROUGH_P2Y_PURINOCEPTOR_1",0.644970414201183,0.824555392904974,0.0519512476197082,0.355258376925918,0.889304894315382,23,"GNG7, GNG12, GNB2"
"65","REACTOME_ADP_SIGNALLING_THROUGH_P2Y_PURINOCEPTOR_12",0.617339312406577,0.813712749983827,0.0544555953940371,0.372419964601477,0.900520574936722,19,"GNG7, GNG12, GNB2"
"66","REACTOME_ADRENALINE_NORADRENALINE_INHIBITS_INSULIN_SECRETION",0.103092783505155,0.449671035590323,0.166933848713193,0.524519715899683,1.33358762615085,26,"ADCY5, GNG7, GNG12, ADRA2A, GNB2, ADCY6, CACNB2"
"67","REACTOME_ADRENOCEPTORS",0.379934210526316,0.726394041270577,0.0833634065110386,0.556498645735832,1.11335722075016,8,"ADRA2A, ADRA1B"
"68","REACTOME_ADVANCED_GLYCOSYLATION_ENDPRODUCT_RECEPTOR_SIGNALING",0.294736842105263,0.655978407557355,0.128788713061714,-0.50401532674578,-1.14573786520548,11,"APP, CAPZA1, AGER, PRKCSH, LGALS3"
"69","REACTOME_AEROBIC_RESPIRATION_AND_RESPIRATORY_ELECTRON_TRANSPORT",2.42376269137865e-06,0.000262978252014584,0.627256739718528,0.498505013210882,1.73369692710508,233,"UQCRQ, LDHA, SDHB, IDH3A, NDUFA1, SUCLA2, MAEA, SURF1, COX7C, ATP5MC2, CYC1, NDUFS6, NDUFA4, PKM, PDK3, UQCRFS1, NUBPL, COA1, PNKD, NDUFAF5, PDK4, ATP5MC3, NDUFB4, MKLN1, PDK2, TACO1, UQCRH, SLC25A12, NDUFB10, COQ10B, IDH3B, ATP5ME, ETFA, LYRM4, COX17, SLC25A27, COX5A, UBA52, ATP5MG, ATP5PF, DMAC2, NDUFB1, NDUFA3, NDUFS5, COX6C, ACAT1, NDUFAF3, ATP5MC1, TMEM126B, MPC2, VDAC1, COX7B, COX5B, UQCC2, PDHX, LDHB, COX16, COX20, ATP5F1A, TRAP1, FH, SMIM20, UBB, ATP5PD, IDH2, UQCRB, ATP5PB, NDUFAF6, OGDH, SCO1, SDHAF3, SLC25A13, NDUFV2, SLC25A18, GLO1"
"70","REACTOME_AFLATOXIN_ACTIVATION_AND_DETOXIFICATION",0.604501607717042,0.810358911966629,0.0588438169595807,0.424359276824738,0.910544794728275,11,"GGT7, GGT5, GGT1, MGST3"
"71","REACTOME_AGGREPHAGY",0.509915014164306,0.786806105905449,0.0609039347452418,0.35777819827869,0.971731123769778,35,"HDAC6, UBA52, PRKN, VIM, TUBB4A, TUBA4A, UBB, TUBB4B, RPS27A, TUBA1C, IFT88, PCNT, DYNC1I2, CFTR, TUBA8, TUBA1A"
"72","REACTOME_AKT_PHOSPHORYLATES_TARGETS_IN_THE_CYTOSOL",0.158653846153846,0.533596385886659,0.138022242496643,0.580182941588832,1.28989023798954,13,"BAD, AKT3, MDM2, CDKN1B, GSK3A, CASP9, CHUK, TSC2"
"73","REACTOME_AKT_PHOSPHORYLATES_TARGETS_IN_THE_NUCLEUS",0.737785016286645,0.871288971614705,0.0501934252649434,0.38384382042268,0.800325874705059,10,"AKT3, RPS6KB2, NR4A1, FOXO3"
"74","REACTOME_ALK_MUTANTS_BIND_TKIS",0.522292993630573,0.794641879273789,0.0653834195468773,0.44859957027413,0.982533247824125,12,"HIP1, FN1, PRKAR1A, EIF2AK3, BIRC6, ALK, CLTC, BCL11A, STRN"
"75","REACTOME_ALPHA_DEFENSINS",0.979123173277662,0.984225726004644,0.0486034247259069,-0.33541862162444,-0.507722638445783,2,"CD4, PRSS3"
"76","REACTOME_ALPHA_LINOLENIC_OMEGA3_AND_LINOLEIC_OMEGA6_ACID_METABOLISM",0.621019108280255,0.814882216156101,0.0571258510018113,0.409686341679755,0.897304586435106,12,"SCP2, FADS1"
"77","REACTOME_ALPHA_OXIDATION_OF_PHYTANATE",0.748815165876777,0.873799725651578,0.0672065093710464,-0.397006089623304,-0.776255379092848,6,"PHYH"
"78","REACTOME_ALPHA_PROTEIN_KINASE_1_SIGNALING_PATHWAY",0.120578778135048,0.482315112540193,0.160801401070022,0.62132513035769,1.33317307804423,11,"MAP3K7, UBA52, UBB, TAB3, TIFA, RPS27A"
"79","REACTOME_ALTERNATIVE_COMPLEMENT_ACTIVATION",0.628070175438596,0.818537267570123,0.0611692626746689,0.508595369106382,0.90382345813331,5,"C3, CFB"
"80","REACTOME_AMINE_LIGAND_BINDING_RECEPTORS",0.343108504398827,0.702596964586847,0.0826646449123753,0.427182816382108,1.09637090069034,27,"HRH2, ADRA2A, ADRA1B, HTR2A"
"81","REACTOME_AMINO_ACIDS_REGULATE_MTORC1",0.331043956043956,0.693617430105576,0.0810802057550866,0.384923293199523,1.09460411322928,47,"RRAGC, RHEB, CASTOR2, TCIRG1, ATP6V1F, SLC38A9, ATP6V1G1, MTOR, ATP6V1E1, SESN1, SEC13, LAMTOR2, ATP6V1D, SESN2, MIOS, CASTOR1, LAMTOR1, ATP6V0D2, ITFG2, ATP6V1B2"
"82","REACTOME_AMINO_ACID_CONJUGATION",0.148148148148148,0.516436114829689,0.175204047558551,-0.715752562348552,-1.35486478749552,5,"GLYATL2, ACSM4, GLYAT"
"83","REACTOME_AMINO_ACID_TRANSPORT_ACROSS_THE_PLASMA_MEMBRANE",0.436950146627566,0.756474103585657,0.070113215764256,0.397052138697041,1.01904007893173,27,"SLC38A1, SLC36A1, SLC7A2, SLC7A8, SLC1A5, SLC38A2"
"84","REACTOME_AMPK_INHIBITS_CHREBP_TRANSCRIPTIONAL_ACTIVATION_ACTIVITY",0.352078239608802,0.715114382656475,0.11146266692298,-0.557239799178288,-1.1304360625132,7,"PRKAA2, ADIPOR2"
"85","REACTOME_AMYLOID_FIBER_FORMATION",0.456944444444444,0.771571285857,0.0652353056017703,0.360758360152528,1.00025411333423,40,"NCSTN, MFGE8, GGA1, UBA52, PRKN, APH1B, GSN, UBB, CST3, FURIN, TSPAN14, TGFBI, RPS27A, B2M"
"86","REACTOME_ANCHORING_FIBRIL_FORMATION",0.511146496815287,0.786806105905449,0.066436413766281,0.428065504627645,0.973726565873605,15,"COL1A1, COL1A2, COL4A2, COL4A1, BMP1, TLL1"
"87","REACTOME_ANCHORING_OF_THE_BASAL_BODY_TO_THE_PLASMA_MEMBRANE",0.00196845327090697,0.059951489092886,0.431707695803346,0.493570041821464,1.56557649406825,92,"CKAP5, PRKAR2B, PRKACA, ODF2, DCTN2, NDE1, CEP78, CEP63, CEP192, IQCB1, TMEM67, CEP76, HAUS6, AHI1, CEP57, CDK5RAP2, SDCCAG8, SSNA1, PAFAH1B1, TTBK2, CEP135, TUBB4A, TUBG1, TUBA4A, MARK4, CEP162"
"88","REACTOME_ANDROGEN_BIOSYNTHESIS",0.410958904109589,0.745480310903079,0.09754492162472,-0.615236804601628,-1.08693872407237,4,"POMC"
"89","REACTOME_ANTIGEN_ACTIVATES_B_CELL_RECEPTOR_BCR_LEADING_TO_GENERATION_OF_SECOND_MESSENGERS",0.689248895434462,0.847049974948856,0.048701086452153,0.336624865383352,0.855866312594034,26,"ITPR1, GRB2, AHCYL1, LYN, PIK3R1, STIM1, PLCG2, PIK3AP1"
"90","REACTOME_ANTIGEN_PRESENTATION_FOLDING_ASSEMBLY_AND_PEPTIDE_LOADING_OF_CLASS_I_MHC",0.284457478005865,0.644671255637313,0.0931454575337804,0.442733537456045,1.13628205211401,27,"ERAP1, SEC24A, HLA-F, HLA-A, TAPBP, CALR, SEC24D, HLA-C, SEC13, PIK3R4, B2M, ERAP2"
"91","REACTOME_ANTIGEN_PROCESSING_CROSS_PRESENTATION",0.081555834378921,0.407865249765055,0.173747838999571,0.409963101252853,1.30236734105183,91,"IKBKG, PSMD5, TIRAP, TLR2, STX4, PSMD8, SEC22B, PSMC2, SEC61G, CYBA, PSMB7, UBA52, SNAP23, HLA-F, HLA-A, HMGB1, PSMB6, PSMD13, ITGB5, TAPBP, SEC61B, CALR, UBB, PSME1, PSMA4, PSMD12, HLA-C, PSMB1, PSMD14, RPS27A, B2M, PSMD6, PSMF1"
"92","REACTOME_ANTIGEN_PROCESSING_UBIQUITINATION_PROTEASOME_DEGRADATION",0.00918790751421177,0.151944124720216,0.380730400722792,0.379468208852451,1.3312874778607,284,"ZBTB16, TRAF7, FBXO17, FBXL12, DZIP3, FBXW5, UBE2E1, PSMD5, LRSAM1, HECW2, LTN1, HECTD1, KLHL42, ANAPC4, SMURF1, UBE2D2, CUL3, GLMN, PSMD8, HECTD2, PSMC2, HECTD3, KLHL20, UFL1, UBR1, FBXO32, ASB13, ANAPC13, CUL7, PSMB7, UBA52, PRKN, UBE2J2, RCHY1, RBX1, PSMB6, ANAPC1, ARIH2, PSMD13, FBXL3, RNF41, UBE2L3, KEAP1, RNF130, CDC26, KLHL2, KLHL3, TRIM69, ATG7, LONRF1, HERC5, ANAPC7, KLHL9, NPEPPS, UBR4, ANAPC5, MYLIP, RLIM, FBXL19, BTBD6, VHL, UBE2M, UBE2E2, FBXL22, UBB, UBE2R2, PSME1, TRIM21, PSMA4, ELOB, FBXW11, UBE2K, RBBP6, HERC4, PSMD12, RNF217, MGRN1, RNF114, ANAPC11, PSMB1, FBXO31, RNF111, CBLB, KLHL22, FBXL4, RNF123, UBA1, PSMD14, SMURF2, ASB3, RPS27A, ASB8, SOCS3, PSMD6, TRIM32, WSB1, PSMF1"
"93","REACTOME_ANTIMICROBIAL_PEPTIDES",0.75186846038864,0.87482818179268,0.0454059226590179,0.3324915997653,0.803972813065165,19,"TLR2, ATOX1"
"94","REACTOME_ANTIVIRAL_MECHANISM_BY_IFN_STIMULATED_GENES",0.0710900473933649,0.390160183066362,0.181383128498408,0.380747182200131,1.26298400564554,138,"EIF4A1, FLNA, NUP188, IKBKG, UBE2E1, IRF3, EIF2S3, UBE2I, NUP54, UBA52, POM121, NUP214, EIF2S1, NUP107, NUP35, POM121C, PPP2R5A, EIF4G3, MAP2K6, TUBB4A, EIF4A2, FANCC, HERC5, TUBA4A, EIF4G2, JAK1, MAPK3, UBB, STAT1, EIF4G1, NUP43, NUP133, KPNA1, EIF4A3, TARBP2, PIN1, EIF4E, FANCE, SEC13, DNAJC3, TUBB4B, RPS27A, TUBA1C"
"95","REACTOME_ANTI_INFLAMMATORY_RESPONSE_FAVOURING_LEISHMANIA_PARASITE_INFECTION",0.398457583547558,0.733672641286847,0.0681513438679483,0.336565464836043,1.03325017693482,70,"PRKAR2B, PRKACA, ITPR1, ADCY5, GNG7, GNG12, AHCYL1, GNB2, ADCY6, GGT5, LYN, RHBDF2, CD163, PLCG2, GGT1, FURIN, GNAI1, FCGR2A, PRKAR1A, ADCY8"
"96","REACTOME_APC_CDC20_MEDIATED_DEGRADATION_OF_NEK2A",0.0718562874251497,0.390160183066362,0.204294756516886,0.557028492278074,1.37863048211517,22,"UBE2E1, ANAPC4, UBA52, ANAPC1, CDC26, ANAPC7, ANAPC5, UBB, ANAPC16, ANAPC11, RPS27A, BUB3"
"97","REACTOME_APC_C_CDC20_MEDIATED_DEGRADATION_OF_CYCLIN_B",0.0989505247376312,0.440456694729558,0.172324344900946,0.557328318338249,1.36235779239151,20,"UBE2E1, ANAPC4, UBA52, ANAPC1, CDC26, ANAPC7, ANAPC5, UBB, ANAPC16, ANAPC11, RPS27A"
"98","REACTOME_APC_C_CDH1_MEDIATED_DEGRADATION_OF_CDC20_AND_OTHER_APC_C_CDH1_TARGETED_PROTEINS_IN_LATE_MITOSIS_EARLY_G1",0.401574803149606,0.736149797537188,0.0687943095604775,0.341693868745706,1.03624543594329,66,"UBE2E1, PSMD5, ANAPC4, PSMD8, PSMC2, PSMB7, UBA52, PSMB6, ANAPC1, PSMD13, CDC26, ANAPC7, ANAPC5, UBB, PSME1, PSMA4, PSMD12, ANAPC16, ANAPC11, PSMB1, PSMD14, RPS27A, PSMD6, PSMF1"
"99","REACTOME_APC_C_MEDIATED_DEGRADATION_OF_CELL_CYCLE_PROTEINS",0.594904458598726,0.803906422423306,0.0487989701682839,0.300909612943155,0.934707468924338,76,"UBE2E1, PSMD5, ANAPC4, PSMD8, PSMC2, PSMB7, UBA52, PSMB6, ANAPC1, PSMD13, CDC26, ANAPC7, ANAPC5, CDK2, UBB, PSME1, PSMA4, PSMD12, ANAPC16, ANAPC11, PSMB1, PSMD14, RPS27A, BUB3, PSMD6, PSMF1, PLK1, PSMB4, CUL1, PSMD11"
"100","REACTOME_APEX1_INDEPENDENT_RESOLUTION_OF_AP_SITES_VIA_THE_SINGLE_NUCLEOTIDE_REPLACEMENT_PATHWAY",0.523227383863081,0.794641879273789,0.0875697115548511,-0.481010969977132,-0.975795604923458,7,"NEIL1, PNKP, XRCC1"
"101","REACTOME_APOBEC3G_MEDIATED_RESISTANCE_TO_HIV_1_INFECTION",0.17719298245614,0.55,0.136490437780413,0.712162115885667,1.26558137456553,5,"BANF1, PSIP1, HMGA1, APOBEC3G"
"102","REACTOME_APOPTOSIS",0.322543352601156,0.685355275539299,0.0734381410838857,0.321727926646518,1.07984985544102,157,"TP63, NMT1, APAF1, HMGB2, PSMD5, PSMD8, PSMC2, BBC3, PPP3CC, BIRC2, BAD, CARD8, TP53BP2, PSMB7, UBA52, APPL1, AKT3, HMGB1, PSMB6, VIM, PSMD13, GSDME, ARHGAP10, ACIN1, PRKCD, FAS, GSN, YWHAH, MAPK3, UBB, TICAM1, PSME1, PSMA4, XIAP, KPNA1, PSMD12, TFDP2, CDH1, TNFSF10, PSMB1, PAK2, PSMD14, RPS27A, YWHAQ, PSMD6, BCL2L11, TJP2, PSMF1, DAPK3, DAPK1"
"103","REACTOME_APOPTOSIS_INDUCED_DNA_FRAGMENTATION",0.618887015177066,0.813712749983827,0.059989249649033,0.462591001254456,0.890479936091104,7,"HMGB2, HMGB1, KPNA1"
"104","REACTOME_APOPTOTIC_CLEAVAGE_OF_CELLULAR_PROTEINS",0.0570108483577008,0.358589973728147,0.321775918075361,-0.448003406184843,-1.37566023836225,34,"OCLN, SPTAN1, FNTA, LMNB1, ADD1, BCAP31, CASP3, PLEC, CASP7, CLSPN, CTNNB1, PRKCQ"
"105","REACTOME_APOPTOTIC_CLEAVAGE_OF_CELL_ADHESION_PROTEINS",0.190355329949239,0.565487662531556,0.160801401070022,-0.608397324035032,-1.28575325064874,8,"OCLN, CASP3, CTNNB1, DSP, DSG2"
"106","REACTOME_APOPTOTIC_EXECUTION_PHASE",0.170212765957447,0.542182315049776,0.204294756516886,-0.367276751683976,-1.18565086811446,42,"OCLN, SPTAN1, FNTA, KPNB1, LMNB1, ADD1, BCAP31, CASP3, PLEC, CASP7, CLSPN, CTNNB1, PRKCQ"
"107","REACTOME_APOPTOTIC_FACTOR_MEDIATED_RESPONSE",0.738670694864048,0.871482172300528,0.0466948041282054,0.333769015127953,0.797939849965754,18,"APAF1, CARD8, GSDME, MAPK3, XIAP, CASP9, CDKN2A, AVEN, UACA, MAPK1, APIP"
"108","REACTOME_AQUAPORIN_MEDIATED_TRANSPORT",0.205555555555556,0.581179876945349,0.109684061970549,0.429995523672484,1.20296205481054,42,"PRKAR2B, PRKACA, ADCY5, GNG7, GNG12, GNB2, ADCY6"
"109","REACTOME_ARACHIDONATE_PRODUCTION_FROM_DAG",0.928070175438596,0.961294644726374,0.0431036828790402,0.332495442161537,0.590876753117162,5,"ABHD6, MGLL"
"110","REACTOME_ARACHIDONIC_ACID_METABOLISM",0.822695035460993,0.8991253336152,0.083129129135339,-0.254684221759134,-0.822177192646269,42,"PON2, CYP2U1, DPEP2, PTGES3, LTC4S, PTGS1, ALOX5AP, FAAH, HPGDS, EPHX2, CYP4B1"
